Element,Critique
Material Origin and Recycled Content,"Specify a minimum of 70% post-consumer recycled (PCR) content for all plastic housing and structural components. For aluminum parts, mandate a minimum of 75% recycled aluminum. For any virgin materials used, prioritize renewable or bio-based sources. Document the origin of all recycled materials for supply chain transparency."
Material Property: Toxicity,"Explicitly state compliance with RoHS and REACH regulations for all components. Conduct and document a comprehensive toxicological assessment for all materials, including additives and coatings, ensuring the absence of hazardous substances beyond those restricted by standard regulations."
Material Property: Recyclability,"For all plastic components, specify the polymer type (e.g., ABS, PP, PC) and ensure compatibility with mechanical recycling infrastructure in major markets. Avoid composite materials that are difficult to separate. For any components requiring bonding, use mechanical fasteners (screws, clips) or easily separable adhesives."
Use of Material: Number of Types,"Minimize the number of distinct material types used in the product. Prioritize mono-materials for major components. Where different materials are unavoidable, ensure they are clearly identifiable and separable for recycling."
Use of Material: Weight Reduction,"While minimizing material volume is a goal, prioritize design for disassembly and durability over extreme lightweighting if it compromises robustness or increases manufacturing complexity and cost. Explore material efficiencies that do not impact longevity or repairability."
Sustainability: End-of-Life Management,"Implement rigorous Design for Disassembly (DfD) principles: use common fasteners (e.g., Phillips head screws), minimize adhesives, design robust snap-fits that can be easily undone, and ensure key components (motor, control board, filters) are easily accessible. Clearly mark all major components with standardized material identification symbols (e.g., ISO 11469). Outline the manufacturer's commitment and proposed logistics for a take-back program, ensuring spare parts are available for a minimum of 7 years post-production."
Aesthetics and Design,"While aiming for a modern, minimalist aesthetic, ensure that finishes (e.g., low-gloss, matte) use low-VOC or water-based coatings. The design should not compromise ease of cleaning, repairability, or material recyclability. Complex cosmetic shells that hinder disassembly should be avoided."
Durability and Reliability,"Target a minimum operational lifespan of 7 years. Specify robust material choices with UV stabilizers where necessary. Mandate accelerated aging tests and define Mean Time Between Failures (MTBF) targets for key components (motor, electronics). Include specifications for resistance to common household cleaning agents and minor spills."
Maintainability and Cleaning,"Design for easy internal cleaning by ensuring access to airflow channels and motor housing via easily removable covers or grilles. If filters are used, specify their material, lifespan, ease of replacement, and availability as spare parts. Specify tool requirements for disassembly, prioritizing standard tools."
Noise Level,"Achieve noise levels below 40dB at low speed and below 50dB at high speed, focusing on aerodynamic design and high-quality motor components. If vibration dampening materials are used, ensure they are easily separable or recyclable and do not add significant complexity or cost."
Cost Target,"While cost is a constraint, it must not compromise sustainability goals. Optimize the Bill of Materials (BOM) to prioritize high recycled content, energy efficiency, durability, and repairability. Factor in the lifecycle cost savings from extended product life and material recovery, not just initial manufacturing cost."
Production: Airflow Generation,"Ensure tight tolerances and precise molding for the air amplifier and internal ducting to achieve efficient, quiet airflow. The design must support the target noise levels and energy efficiency claims."
Production: Energy Efficiency,"Specify target energy consumption metrics (e.g., W/CFM) and compare against industry benchmarks. Mandate ultra-low standby power (<0.5W) for the power adapter. Consider user-configurable 'eco-modes'. Ensure wiring and power components use easily recyclable metals and avoid hazardous substances in circuit boards."
Production: Safety,"Ensure compliance with international safety standards (CE, UL). Design for base stability and ensure air intake/outlet grille designs prevent finger insertion while minimizing impact on airflow efficiency. Integrate overheating shut-offs and motor controller safety features."
Production: User Interface,"Initially, prioritize a simple, robust physical button interface on the unit. If a remote control is included, it must be rechargeable (specify battery chemistry for recyclability) and designed for easy battery replacement. Avoid smart connectivity (Wi-Fi/Bluetooth) for the initial product to manage cost and complexity, focusing on core sustainability features."
Production: Airflow Control and Oscillation,"Design the oscillation mechanism for easy repair with durable, ideally mono-material components. Ensure the mechanism is robust for a 7-year lifespan and integrated efficiently without excessive bulk or cost. Optimize the energy consumption of the oscillation motor."
In-Service: Product Use Time/Lifetime,Design for a minimum operational lifespan of 7 years. Emphasize modularity and component accessibility for repair and potential upgrades. Commit to making critical spare parts available for at least 7 years post-production.
In-Service: Energy Consumption During Use,Set specific energy consumption targets (W/CFM) and aim for ultra-low standby power for the power adapter. Design the power adapter for longevity and repairability. Explore user-configurable 'eco-modes' that prioritize energy savings.
"In-Service: Robustness, Reliability, and Maintenance","Specify drop test standards and resistance to common household spills. Define MTBF targets for key components. Ensure ease of disassembly using standard tools, component accessibility for wear items and failure points, and availability of spare parts for 7+ years. Include simple diagnostic indicators."
In-Service: User Interface and Control,"Ensure physical controls are robust and easy to clean. If a remote is included, it must be rechargeable and designed for easy battery replacement using user-replaceable cells. Clearly define long-term support for any smart features, if included in future iterations, to prevent obsolescence."
Circularity: Core Functionality,Prioritize modularity within the internal airflow system to allow for easier replacement of worn parts or upgrades. Avoid composite materials or adhesives that hinder material recovery in this critical system.
Circularity: User Interface,"If a rechargeable remote is used, specify easily recyclable battery chemistries (e.g., NiMH) or design for simple user replacement of standard cells. Consider the longevity of software for any smart features to prevent obsolescence."
Circularity: Durability and Reliability,"Focus on designing for repairability to extend lifespan beyond 7 years. Use standard, easily replaceable components and avoid proprietary parts. Specify testing for wear and tear on moving parts within the airflow generation system."
