Agent Role,Element,Critique
Material & Design Expert,Sustainable Materials Selection,"The PDS outlines a strong commitment to using recycled plastics (PCR) for the housing and internal components, which is excellent for reducing reliance on virgin fossil fuels. However, the origin of these PCR plastics isn't specified. Are they locally sourced to minimize transportation emissions? Are they from a single polymer type to facilitate easier recycling? For the heating element, while ceramic and advanced alloys are mentioned for durability and efficiency, their recyclability at end-of-life needs clarification. Are these materials easily separable and recyclable? The commitment to 100% recycled and recyclable cardboard packaging with soy-based inks is commendable. The emphasis on suppliers with environmental certifications is crucial, but the PDS could be strengthened by specifying the types of certifications sought (e.g., ISO 14001, Cradle to Cradle) and the ethical labor standards (e.g., Fair Trade)."
Material & Design Expert,Energy Efficiency,"The choice of a high-efficiency brushless DC (BLDC) motor is a significant positive step. The optimization of the heating element for rapid and even heat distribution is also important. However, the PDS could benefit from quantifying the expected energy savings compared to a baseline conventional dryer. 'Meeting or exceeding current energy efficiency standards' is good, but specifying which standards and by what margin would add rigor. Intelligent heat sensing and auto-shutoff are excellent features for waste reduction, but their implementation details (e.g., sensor accuracy, shutoff delay) could be elaborated upon to ensure optimal performance."
Material & Design Expert,Durability and Longevity,"The focus on high-quality components and ease of repair is vital for product longevity and reducing e-waste. Specifying the 'minimum number of operational cycles' and 'drop tests from a specified height' with concrete values would provide measurable targets. The resistance to 'common household chemicals and UV degradation' is important for maintaining aesthetics and function. However, the PDS could also consider the potential for material degradation over time due to heat exposure from the heating element, and how this is mitigated."
Material & Design Expert,Reduced Noise Pollution,"Integrating acoustic dampening materials and optimizing fan blade design are effective strategies. Setting a target noise level below 70 dB at 1 meter is a good benchmark. The PDS could be enhanced by specifying the types of acoustic dampening materials considered and their own sustainability credentials (e.g., recycled content, biodegradability). A comparative analysis with market leaders is a good practice, but the PDS should also consider the environmental impact of producing these dampening materials themselves."
Material & Design Expert,Ergonomics and User Comfort,"Balancing weight distribution, non-slip grip, and intuitive controls are essential for user experience. The adjustable airflow and heat settings are standard but crucial. The PDS could explore the use of bio-based or recycled materials for the grip to further enhance sustainability. The user testing methodology to validate ergonomic claims could also be mentioned."
Material & Design Expert,Product End-of-Life Management,"The commitment to design for disassembly with minimal adhesives and easily removable fasteners is excellent. Clear material labeling is critical for effective recycling. The establishment of a take-back program or partnership with recycling facilities is a strong indicator of a circular economy approach. However, the PDS could be more specific about the types of fasteners to be used (e.g., screws instead of snap-fits where possible) and the expected recyclability rate of the components. The user manual should also clearly indicate which components are not recyclable and should be disposed of responsibly."
Material & Design Expert,Safety Features,"Automatic overheat protection, adherence to safety standards (UL, CE), and a durable power cord are fundamental. The cool shot function is a standard but important feature. The PDS could consider the materials used for the electrical components and their recyclability or potential for hazardous substances. Ensuring the power cord is made from recycled materials or is easily separable for recycling would be a valuable addition."
Material & Design Expert,Performance and Functionality,"Optimizing airflow and heat output for comparable or better drying times is a key performance indicator. Multiple speed and heat settings, along with effective attachments, are expected. The PDS should ensure that the materials used for the heating element and motor are not only efficient but also do not degrade performance over the product's lifespan, and that their end-of-life processing is considered."
Material & Design Expert,Aesthetics and Design Language,"A minimalist, clean, and contemporary design with nature-inspired colors is a good fit for a sustainable product. The durability of the finish is important for longevity. The PDS could explore the use of low-VOC (Volatile Organic Compound) finishes and paints to further enhance the sustainability of the aesthetic choices. The materials used for the colorants should also be considered for their environmental impact and recyclability."
Material & Design Expert,Cost-Effectiveness and Affordability,"Balancing sustainability with cost is a critical challenge. Highlighting long-term consumer savings through energy efficiency and durability is a good strategy. A tiered product offering could allow for broader market penetration. The PDS would be strengthened by a more detailed Life Cycle Cost Analysis (LCCA) that explicitly quantifies the environmental costs alongside economic costs, and how these are managed through material choices and design."
Production Engineer,Sustainable Materials Selection,"Using post-consumer recycled (PCR) plastics is a good idea, but we need to be realistic about the cost and availability of high-quality PCR materials that meet regulatory requirements for electrical appliances. Sourcing can be complex and lead to inconsistent material properties, potentially impacting durability and aesthetics. Advanced alloys for the heating element sound expensive; we need to confirm if ceramic or simpler, robust alloys can achieve the desired durability and efficiency at a lower cost. Packaging is straightforward, but the '100% recycled and recyclable' claim needs verification for all components, including inks and any internal protective elements. Supplier certifications add a layer of complexity and cost to sourcing."
Production Engineer,Energy Efficiency,"High-efficiency BLDC motors are great for performance but are significantly more expensive than traditional AC motors. We need a solid cost-benefit analysis to justify this upfront cost. Intelligent heat sensing and auto-shutoff add electronic complexity and potential points of failure, increasing manufacturing and repair costs. Meeting or exceeding Energy Star is a good target, but we need to ensure the chosen components and design allow for this without excessive cost."
Production Engineer,Durability and Longevity,"Designing for easy repair and readily available spare parts sounds good in theory, but in practice, it adds significant overhead in terms of documentation, inventory management, and customer service. This can drive up the overall cost of ownership for the business. Ensuring 1000 hours of continuous use and drop tests requires rigorous and potentially expensive testing protocols. Resistance to household chemicals and UV degradation needs specific material choices that might conflict with cost or recyclability goals."
Production Engineer,Reduced Noise Pollution,"Acoustic dampening materials add cost and potentially bulk to the design. Optimizing fan blade design for aerodynamics is standard practice, but achieving a target of below 70 dB might require specialized, more expensive components or design iterations that increase manufacturing complexity. Comparative analysis is necessary, but we must ensure we're not chasing an overly ambitious target that inflates the bill of materials."
Production Engineer,Ergonomics and User Comfort,"Balancing weight distribution and using non-slip, textured grips are fairly standard design considerations. The main concern here is ensuring these features don't add significant tooling costs or complicate the assembly process. Intuitive controls are also standard, but the complexity of the electronics behind them needs to be managed to avoid cost overruns."
Production Engineer,Product End-of-Life Management,"Designing for disassembly with minimal adhesives and easily removable fasteners is a good goal, but it can sometimes lead to less robust product construction if not carefully managed. Clear material labeling adds a manufacturing step. Establishing a take-back program or partnerships with recycling facilities is a significant logistical and financial undertaking that needs careful planning and budgeting. Providing detailed disassembly instructions can be complex and may not be fully utilized by consumers."
Production Engineer,Safety Features,"Automatic overheat protection and meeting safety standards (UL, CE) are non-negotiable and will require certified components and thorough testing, which adds to the cost. A durable power cord and secure plug are standard safety requirements. The cool shot function is a common feature but adds to the complexity of the heating element control and electronics."
Production Engineer,Performance and Functionality,"Achieving drying times comparable to or better than high-performance dryers with a focus on energy efficiency and potentially sustainable materials is a significant challenge. This often requires powerful motors and efficient heating elements, which can drive up cost and complexity. Multiple speed and heat settings are standard but require sophisticated control circuitry. Designing effective attachments adds to the part count and tooling costs."
Production Engineer,Aesthetics and Design Language,"Minimalist design is generally cost-effective, but achieving a 'premium user experience' with durable finishes that resist fingerprints and scratches can require more expensive coatings or materials. Offering a range of nature-inspired colors means managing more SKUs and potentially higher paint/dye costs for the plastic components."
Production Engineer,Cost-Effectiveness and Affordability,"This is the most critical element. While sustainability and performance are important, they must be balanced with realistic production costs. The proposed features (BLDC motors, advanced materials, complex electronics, extensive testing, potential take-back programs) all point towards a higher initial cost. A tiered product offering could help, but each tier needs to be carefully costed. A thorough Life Cycle Cost Analysis is essential, but we must ensure the upfront manufacturing cost is competitive enough for market penetration. We need to prioritize features that offer the best balance of sustainability, performance, and cost, rather than trying to incorporate every 'green' or 'advanced' feature."
In-Service Expert,Sustainable Materials Selection,"While the intention to use PCR plastics, durable heating elements, and eco-friendly packaging is commendable, the PDS needs to be more specific about the *percentage* of PCR content and the *types* of advanced alloys or ceramics. Simply stating 'preference' is not a strong enough commitment. Furthermore, the 'low embodied energy' claim needs substantiation with data. For biodegradability, it's crucial to define the conditions and timeframe for degradation, as many 'biodegradable' plastics require industrial composting facilities, which are not universally accessible. The PDS should also detail how the 'post-consumer recycled' status will be verified and tracked. Lastly, while ethical labor practices are vital, they are often difficult to audit effectively throughout a complex global supply chain; the PDS should outline the *specific* auditing mechanisms and supplier requirements."
In-Service Expert,Energy Efficiency,"The focus on BLDC motors and optimized heating elements is good. However, the PDS lacks concrete targets for energy efficiency beyond 'exceed current standards.' What is the target wattage? What is the expected drying time compared to a benchmark product? 'Intelligent heat sensing and auto-shutoff' are mentioned, but the implementation details and their impact on user experience (e.g., accidental shut-off) are not discussed. The PDS should quantify the energy savings expected from these features and provide a clear comparison to existing products. The absence of a specific energy rating target (like a kWh/year estimate) is a missed opportunity for clear communication to the consumer."
In-Service Expert,Durability and Longevity,"A minimum of 1000 operational hours is a decent starting point, but for a product intended to reduce waste, a longer lifespan should be targeted. The PDS needs to define 'high-quality, robust components' with specific material grades or performance metrics. 'Accessible components and readily available spare parts' is excellent, but the PDS must detail *how* this accessibility will be ensured (e.g., modular design, standardized parts, online parts portal, guaranteed availability period). The drop test specification needs to be more detailed (e.g., height, surface, number of drops, any functional requirements post-drop). Resistance to household chemicals and UV degradation should also be quantified with specific test standards."
In-Service Expert,Reduced Noise Pollution,"A target of 70 dB is a good benchmark, but the PDS should specify the measurement conditions (distance, mode of operation). The mention of 'acoustic dampening materials' is vague; specific types and their placement should be considered. Optimizing fan blade design is key, but the PDS doesn't mention any computational fluid dynamics (CFD) analysis or wind tunnel testing to validate these claims. The 'comparative analysis' should be a rigorous benchmarking process, not just an informal review."
In-Service Expert,Ergonomics and User Comfort,"While important for user satisfaction, ergonomics don't directly address the core in-service concerns of environmental impact and repairability. The PDS should ensure that ergonomic features do not hinder disassembly or the use of standardized components. For example, a 'non-slip, textured grip' should not be permanently molded in a way that makes replacement difficult. The focus on preventing heat damage is good, but this ties into the 'Performance and Functionality' section as well."
In-Service Expert,Product End-of-Life Management,"This is a strong section, but the PDS needs to be more concrete. 'Designed for disassembly' requires specific design choices (e.g., screw types, avoiding snap-fits that break easily, minimizing adhesives). 'Clearly labeled with material types' is good, but the PDS should specify the labeling standard (e.g., ISO 11469). The 'take-back program' needs a clear operational plan: who manages it, what are the logistics, and what incentives are offered to consumers? Providing information in the user manual is a start, but proactive communication and easy access to disassembly guides are crucial."
In-Service Expert,Safety Features,"The safety features listed are standard for hair dryers. The PDS should confirm that these features are designed to be reliable and not prone to nuisance tripping. For example, the overheat protection should have a sufficient lifespan and be easily resettable if possible, or the component should be replaceable. The durability of the power cord and plug is essential for safety and longevity, and this should be linked to the 'Durability and Longevity' section."
In-Service Expert,Performance and Functionality,"While essential for market acceptance, performance metrics need to be balanced with longevity. For instance, extremely high airflow or heat might lead to faster wear on the motor or heating element if not designed with exceptional durability. The PDS should define 'comparable or better' drying times with specific metrics (e.g., time to dry X volume of hair under Y conditions). The design of attachments should also consider their durability and ease of cleaning to prevent performance degradation over time."
In-Service Expert,Aesthetics and Design Language,"Aesthetics are subjective and secondary to in-service performance and repairability. The PDS should ensure that the 'sleek and ergonomic' design does not compromise access to internal components for maintenance or repair. 'Durable finish' is important for longevity, but the PDS should specify the type of finish and its resistance to wear and tear, as well as its environmental impact (e.g., VOCs). Nature-inspired colors are a nice touch but don't directly impact the product's in-service environmental footprint."
In-Service Expert,Cost-Effectiveness and Affordability,"While cost is a business consideration, it should not lead to compromises on durability, repairability, or the use of truly sustainable materials. The PDS needs to ensure that 'cost-effectiveness' doesn't translate to using cheaper, less durable components or making the product difficult to repair. The 'Life Cycle Cost Analysis' is a critical tool that should be used to *justify* the upfront investment in higher-quality, more sustainable components by demonstrating long-term savings for the consumer and reduced environmental burden. The PDS should also consider the cost of spare parts and repair services."
Circularity Expert,Sustainable Materials Selection,"While the intention to use PCR plastics is commendable, the PDS needs to be more specific about the types of PCR plastics and their compatibility for different components. The use of 'advanced alloys' for the heating element is concerning. Alloys, especially complex ones, can be difficult to recycle and often involve hazardous materials. Ceramic is a better choice for recyclability. The avoidance of single-use plastics in packaging is excellent, but the PDS should detail how the recycled cardboard will be treated to ensure durability and protection without relying on virgin materials or coatings that hinder recyclability. The mention of 'ethical labor practices' is crucial but needs to be backed by a concrete supplier vetting process."
Circularity Expert,Energy Efficiency,"The selection of a BLDC motor is a good step towards energy efficiency. However, the PDS doesn't specify the target efficiency rating for the motor or the heating element. 'Optimized for rapid and even heat distribution' is vague; quantifiable metrics are needed. The inclusion of intelligent heat sensing and auto-shutoff is positive, but the PDS should detail how these features are implemented to ensure they don't add complexity that hinders repair or disassembly. The PDS should also consider the energy consumed by the control electronics, not just the motor and heating element."
Circularity Expert,Durability and Longevity,"The commitment to high-quality components is good, but the PDS lacks specifics on what constitutes 'high-quality' in terms of material lifespan and resistance to wear. 'Facilitate easy repair and maintenance' is a strong claim, but the PDS needs to detail *how* this is achieved. Are components modular? Are there common failure points that will be reinforced? Specifying the minimum operational cycles and drop test heights is good, but these should be benchmarked against industry standards for professional-grade appliances to ensure true longevity. Resistance to 'common household chemicals' is important, but the PDS should specify which chemicals and what level of resistance is required, as some chemicals can degrade plastics and affect recyclability."
Circularity Expert,Reduced Noise Pollution,"Integrating acoustic dampening materials is a good approach. However, the PDS should specify the *type* of materials used for dampening and their end-of-life implications. Are these materials recyclable or easily separable? Optimizing fan blade design is key, but the PDS doesn't mention if the fan itself will be made from easily recyclable materials. The target noise level of 70 dB is a good benchmark, but the PDS should also consider the *frequency* of the noise, as some frequencies are more irritating than others."
Circularity Expert,Ergonomics and User Comfort,"While ergonomics are important for user experience, the PDS doesn't address how these design choices impact circularity. For example, is the non-slip grip material integrated into the housing, making it difficult to separate for recycling? The PDS should consider if the chosen materials for grip and texture can be easily recycled or if they create a composite that hinders material recovery. Balancing weight is good, but the PDS should also consider the weight of the materials used from a resource perspective."
Circularity Expert,Product End-of-Life Management,"This is a critical section, and the PDS has some good intentions. However, 'minimal use of adhesives' is a weak statement. The goal should be *zero* adhesives, especially permanent ones. All fasteners should be standard, easily removable types (e.g., screws, clips). 'Clearly labeled with material types' is essential, but the PDS needs to specify the labeling standard (e.g., ISO 11469). The take-back program is a good initiative, but its logistical feasibility and scalability need to be addressed. Providing disassembly and recycling information is excellent, but the PDS should also consider designing for *repair* as a primary end-of-life strategy before disposal/recycling."
Circularity Expert,Safety Features,"Safety features are paramount, but the PDS doesn't detail how these features might impact disassembly or repair. For instance, is the overheat protection system a simple, replaceable fuse or a complex electronic module that's difficult to service? The durability of the power cord is important, but the PDS should also consider if the cord itself is made from recyclable materials and if it can be easily disconnected from the main unit for separate recycling."
Circularity Expert,Performance and Functionality,"While performance is key for user acceptance, the PDS doesn't link performance metrics to circularity. For example, are the attachments designed to be easily detached and replaced if damaged, or are they integral to the nozzle assembly? The consistency of performance over the lifespan is good, but this ties back to the durability of components and the ease of repair. If a component fails, can it be easily swapped out to restore performance, or does the entire unit need replacement?"
Circularity Expert,Aesthetics and Design Language,"Aesthetics are subjective and often conflict with circularity. 'Minimalist and clean design' can be good if it means fewer parts and simpler construction. However, the PDS doesn't specify materials for the finish. Are these finishes durable and non-toxic, and importantly, do they hinder the recyclability of the underlying plastic? Using 'nature-inspired color palettes' is fine, but the dyes used should be considered for their environmental impact and recyclability. The PDS should ensure that the aesthetic choices do not lead to composite materials or finishes that are difficult to separate or recycle."
Circularity Expert,Cost-Effectiveness and Affordability,"While cost is a practical consideration, the PDS needs to ensure that cost-saving measures do not compromise circularity. For example, using cheaper, less durable materials or opting for glued assemblies to reduce manufacturing costs would be detrimental. The 'tiered product offering' needs careful consideration to ensure that even the lower-cost variants adhere to core sustainability principles and are designed for disassembly and repair. A Life Cycle Cost Analysis (LCCA) is excellent, but it must explicitly include the cost of end-of-life management and material recovery."
