PDS Element,Critique
Sustainable Materials Selection,"The PDS states a preference for PCR plastics, which is good, but lacks specific targets or percentages. It would be beneficial to define a minimum percentage of PCR content for housing and internal components to ensure a measurable impact.; While ceramic or advanced alloys are mentioned for the heating element, the PDS could be more specific about the 'advanced alloys' and their recyclability or end-of-life considerations. Are these alloys easily separable for recycling?; The PDS mentions 'suppliers with strong environmental certifications and ethical labor practices.' This is a crucial but broad statement. It would be stronger to specify desired certifications (e.g., ISO 14001, SA8000) or a framework for supplier auditing.; The PDS could benefit from a more detailed lifecycle assessment (LCA) approach to material selection, considering not just recyclability and embodied energy, but also the impact of extraction, manufacturing, and transportation of these materials."
Energy Efficiency,"The PDS correctly identifies BLDC motors and optimized heating elements. However, it lacks quantitative targets for energy efficiency. For instance, specifying a target wattage or a percentage reduction in energy consumption compared to a benchmark product would be more impactful.; The mention of 'current energy efficiency standards (e.g., Energy Star if applicable)' is a good starting point, but the PDS should commit to exceeding these standards if possible, rather than just meeting them, to truly differentiate as a sustainable product.; While intelligent heat sensing and auto-shutoff are good features, the PDS could detail how these will be implemented and what their impact on energy savings is expected to be. For example, 'auto-shutoff after 10 minutes of inactivity' or 'heat sensing to maintain optimal drying temperature'."
Durability and Longevity,"The PDS mentions 'high-quality, robust components,' but this is subjective. It would be more effective to specify material grades or performance standards for key components (e.g., motor lifespan in hours, casing impact resistance).; The target of '1000 hours of continuous use' is a good benchmark, but it's important to clarify if this is representative of typical user behavior. A more realistic approach might involve defining a 'typical user lifecycle' and ensuring durability for that period.; While 'easy repair and maintenance' and 'readily available spare parts' are stated, the PDS could elaborate on the design strategies for this, such as modular design, standardized fasteners, and a clear plan for spare parts distribution and availability.; The PDS mentions drop tests but doesn't specify the height or conditions. A defined drop test protocol (e.g., from handle height onto a hard surface) would provide a clearer measure of robustness."
Reduced Noise Pollution,"The target of 'below 70 dB at 1 meter' is a good quantitative goal. However, the PDS could also consider specifying the frequency spectrum of the noise, as certain frequencies can be more irritating than others.; The PDS mentions 'acoustic dampening materials' but doesn't specify the types or their environmental impact. Are these materials sustainable themselves (e.g., recycled content, non-toxic)?; The PDS should also consider noise generated by airflow *through* the device, not just the motor. Optimization of internal ducting and nozzle design can significantly reduce turbulence noise."
Ergonomics and User Comfort,"The PDS mentions 'balanced weight distribution' and a 'non-slip, textured grip.' These are good qualitative statements, but user testing with diverse demographics would be crucial to validate these claims and identify potential improvements.; The PDS could specify target weight ranges and handle dimensions to ensure broad appeal and comfort.; While 'intuitively placed controls' is desirable, it would be beneficial to define specific control types (e.g., slider, button) and their placement based on ergonomic principles and user feedback."
Product End-of-Life Management,"The PDS mentions 'minimal use of adhesives and easily removable fasteners.' This is excellent. It would be strengthened by specifying the types of fasteners (e.g., screws instead of snap-fits where possible) and a target percentage of non-adhesive assembly.; The PDS states 'components will be clearly labeled with material types.' This is a critical step, but the PDS should also consider the feasibility and cost of implementing such labeling across all components, especially small internal parts.; The PDS mentions a 'take-back program or partnership with recycling facilities.' This is a significant undertaking. The PDS should outline the operational and financial implications of such a program, including logistics and potential partnerships."
Safety Features,"The PDS mentions meeting 'relevant safety standards (e.g., UL, CE certification).' This is a fundamental requirement. The PDS should commit to achieving these certifications as a baseline, not as an aspirational goal.; While 'automatic overheat protection' is mentioned, the PDS could specify the type of sensor and the temperature thresholds for activation to ensure adequate safety margins.; The PDS could also consider additional safety features such as double insulation, a thermal fuse for redundancy, or a GFCI plug if the product is intended for use in wet environments."
Performance and Functionality,"The PDS states 'drying times comparable to or better than conventional high-performance hair dryers.' This is a key performance metric. It would be more robust to define specific targets for airflow (e.g., CFM) and heat output (e.g., temperature range at nozzle exit) and benchmark them against leading competitors.; The PDS mentions 'multiple speed and heat settings.' It would be beneficial to specify the number of settings for each and the range of temperatures and airflow speeds they provide.; The design of attachments is mentioned, but the PDS could detail their aerodynamic efficiency and how they contribute to targeted airflow and styling effectiveness."
Aesthetics and Design Language,"While 'minimalist and clean design' and 'nature-inspired color palettes' are good starting points, the PDS could benefit from developing a more detailed visual language guide, including specific material finishes, textures, and form factor guidelines.; The PDS should consider how the aesthetic choices align with the sustainable ethos. For example, using matte finishes that are less prone to showing fingerprints might also reduce the need for frequent cleaning, thus saving water and energy.; The PDS could also explore the use of natural textures or patterns that evoke sustainability without compromising on a premium feel."
Cost-Effectiveness and Affordability,"The PDS acknowledges balancing cost and sustainability. It would be strengthened by establishing a target retail price range or a maximum Bill of Materials (BOM) cost to guide design and material choices.; The PDS mentions highlighting long-term cost savings. This is a good marketing strategy, but the PDS should quantify these savings based on the energy efficiency and durability targets.; The idea of a 'tiered product offering' is good, but the PDS needs to define the criteria for differentiation between tiers while ensuring core sustainability principles are maintained across all variants. This could be based on features, materials, or performance levels.; The PDS mentions Life Cycle Cost Analysis (LCCA). This is crucial. The PDS should commit to performing this analysis and using its results to inform design decisions, particularly regarding the trade-offs between upfront cost and long-term operational and environmental costs."
