PDS Element,Justification
Sustainable Materials Selection,"To minimize the environmental impact of the product's lifecycle, materials will be chosen based on their recyclability, low embodied energy, ethical sourcing, and defined performance characteristics. A cradle-to-grave LCA will guide these choices, focusing on carbon footprint, water scarcity, and ecotoxicity.; The hair dryer housing will incorporate a minimum of 70% post-consumer recycled (PCR) ABS plastic, with a target of 90% PCR for non-critical internal components (e.g., internal brackets, fan shroud). Recyclability of these specific PCR types will be verified through supplier data and adherence to ISO 11469 standards for labeling. Material traceability, including origin and batch numbers, will be maintained.; The heating element will utilize durable ceramic. Its recyclability at end-of-life will be addressed by designing for disassembly and providing clear instructions for ceramic waste disposal through designated recycling channels. If advanced alloys are considered, their specific composition will be documented to ensure separation and recycling feasibility.; Packaging will be made from 100% recycled and recyclable cardboard, printed with soy-based inks, and will avoid single-use plastics. It will be designed for easy separation of materials for recycling.; Suppliers must demonstrate adherence to environmental management systems (ISO 14001 certified) and ethical labor practices, with a preference for those certified under SA8000 or equivalent. Ethical sourcing will be defined by adherence to conflict-free mineral regulations and fair labor standards."
Energy Efficiency,"To significantly reduce operational energy consumption, the hair dryer will achieve a minimum 25% reduction in energy consumption compared to a benchmark of three specific leading conventional hair dryers (e.g., Dyson Supersonic, BaBylissPRO Nano Titanium, Conair InfinitiPro) under standardized test conditions.; The motor will be a high-efficiency brushless DC (BLDC) motor, designed to consume no more than 1400W while delivering an airflow of at least 60 CFM, equivalent to or exceeding the performance of benchmark 1800W AC motor models.; Intelligent heat sensing technology, utilizing a precision temperature sensor with a response time of under 100ms, will actively regulate airflow temperature to maintain optimal drying conditions (60-80°C at nozzle exit) and prevent energy waste from overheating. 'Optimal drying temperatures' are defined as those that efficiently dry hair without causing thermal damage.; The product will exceed Energy Star requirements by at least 15% and will achieve a standby power consumption of less than 0.5W. The design will facilitate certification under relevant energy efficiency standards.; An auto-shutoff feature will deactivate the device after 15 minutes of inactivity. This duration is deemed optimal for user convenience and energy conservation, and will not be user-configurable to ensure consistent energy savings."
Durability and Longevity,"The hair dryer will be designed for a minimum operational lifespan of 1500 hours of typical use, defined as 30 minutes of daily operation for 5 days a week, equating to approximately 5 years of service.; Key components, including the motor (rated for 1500 operational hours), heating element, switches, and electronics, will be selected to meet or exceed this 1500-hour lifespan. The casing will withstand multiple drop tests from 1.0 meter onto a hard surface from various orientations without compromising functionality or safety.; The design will feature modular construction with standardized fasteners (e.g., Phillips head screws) and a maximum of 5 disassembly steps using common tools. The product will withstand at least 5 disassembly/reassembly cycles without degradation. A repair manual and spare parts will be available for 7 years post-discontinuation.; Materials will be selected to meet specific performance standards, such as ASTM D256 for impact resistance for the casing. Resistance to humidity, dust ingress (IP20 rating), and thermal cycling will be ensured through material selection and sealing."
Reduced Noise Pollution,"The hair dryer will operate at a noise level of no more than 68 dB at 1 meter, with a focus on minimizing high-frequency whine (below 4 kHz) and ensuring the overall noise profile is not perceived as irritating.; Acoustic dampening materials, such as recycled PET felt with a minimum sound absorption coefficient of 0.7 at 2000 Hz, will be integrated into the motor housing and airflow path. Internal ducting and nozzle geometry will be engineered to ensure smooth airflow, reducing turbulence noise.; Fan blade design will be optimized for aerodynamic efficiency, targeting specific pressure and flow coefficients to minimize noise. The design will also address noise generated from air turbulence at the nozzle and vents.; While 68 dB is the target, further noise reduction will be pursued if achievable without compromising performance or significantly increasing cost. The aesthetic design will not introduce additional noise sources."
Ergonomics and User Comfort,"The hair dryer will have a target weight of under 500 grams (excluding cord) with a balanced center of gravity for reduced user fatigue. Handle grip diameter will be between 35-45mm, featuring a soft-touch, non-slip recycled TPE grip with a specified coefficient of friction of >0.8 when wet.; Controls will be intuitively placed, with tactile feedback and clear labeling. The cool shot button will be easily accessible for thumb operation. User testing with diverse groups will validate ergonomic claims and refine the design.; The power cord will be a minimum of 2.5 meters in length, flexible, and tangle-resistant to enhance user comfort and safety during use. The cord will be designed to withstand significant bending cycles without degradation."
Product End-of-Life Management,"The product will be designed for disassembly, with at least 90% of components removable using standard tools (e.g., Phillips head screwdrivers) within a maximum of 5 steps. Adhesives will be minimized, replaced by snap-fits or screws.; All major plastic components will be clearly labeled with material type (e.g., ABS, PP) per ISO 11469. A QR code on the product will link to multilingual disassembly and recycling instructions accessible via a dedicated online portal.; A take-back program will be established in key markets, partnering with R2 or e-Stewards certified e-waste recyclers. The logistics and financial models for this program will be developed to ensure responsible collection and recycling.; Consideration will be given to component refurbishment or reuse where feasible as part of the end-of-life strategy, in addition to recycling."
Safety Features,"The hair dryer will achieve and exceed UL and CE certifications, including compliance with the IEC 60335 series for household appliances. It will feature double insulation (Class II appliance).; An automatic overheat protection system will include a primary bimetallic thermal fuse tripping at 150°C and a secondary thermal cut-off at 160°C, both with manual reset functionality. The design will prevent burns from hot surfaces beyond the nozzle.; The product will be designed for use in typical household environments. If specific variants are intended for wet environments, GFCI protection will be incorporated.; A cool shot function will provide ambient temperature air for at least 10 seconds, with the 'cool' setting not exceeding 30°C. Cord strain relief and durability will be tested to prevent electrical shock hazards."
Performance and Functionality,"The hair dryer will deliver an airflow rate of at least 60 CFM and a heat output capable of reaching 80°C at the nozzle exit, measured under standardized test conditions (e.g., 120V, high speed/heat setting). Drying time will be benchmarked against leading competitors.; The product will offer 3 speed settings (Low, Medium, High) and 3 heat settings (Cool, Warm, Hot), with distinct incremental differences between settings. A dedicated Cool Shot button will provide a rapid burst of cool air.; Included attachments (concentrator nozzle, diffuser) will be designed for optimal aerodynamic efficiency, ensuring targeted airflow and even distribution respectively. Their effectiveness will be validated through user testing and airflow analysis.; Drying effectiveness will be assessed through standardized drying time tests and user satisfaction ratings related to hair smoothness and frizz reduction."
Aesthetics and Design Language,"The design will feature a minimalist, clean aesthetic with natural-inspired color palettes (e.g., muted sage green, slate blue, sandstone beige) and matte or satin finishes that resist fingerprints and scratches.; Textures and finishes will evoke natural materials or recycled content, providing a premium tactile and visual experience. Visual references and sketches will define the 'streamlined form factor' emphasizing eco-consciousness.; Design principles will include 'simplicity,' 'honesty of materials,' and 'timelessness,' ensuring the aesthetic communicates sustainability without overt 'green-washing.' The design will balance modern appeal with eco-friendly messaging."
Cost-Effectiveness and Affordability,"The product will target a retail price range of $120-$150 USD with a maximum Bill of Materials (BOM) cost of $40. This will be achieved through optimized design and material selection, balancing sustainability with cost.; Long-term cost savings for consumers will be quantified based on estimated energy consumption reduction (25%) and product lifespan (5 years), using current electricity prices and typical usage patterns. These savings will be communicated in marketing.; A tiered product offering may be developed, with core sustainability features maintained across all tiers. Differentiation will be based on material finishes, color options, or accessory bundles.; A Life Cycle Cost Analysis (LCCA) will be performed to inform design trade-offs, ensuring the product offers value by minimizing total cost of ownership, including upfront, operational, and end-of-life expenses. Sustainability certifications and their associated costs will be factored into the BOM."
