Agent Role,Element,Critique
In-Service Expert,"Maintenance and Cleaning: Hygienic & Disassemblable Design (Smooth, non-porous, stain-resistant, minimal crevices, mechanical disassembly)","The focus on hygienic materials, minimal crevices, and easy mechanical disassembly for thorough cleaning directly addresses user needs and promotes product longevity. Smooth, non-porous, and stain-resistant materials are ideal for a bathroom product. The ability to easily disassemble key components for cleaning prevents the build-up of residue and potential microbial growth, which can lead to product failure or unsanitary conditions. This design choice supports both user health and the product's intended lifespan, reducing the need for harsh cleaning agents that could degrade materials over time."
In-Service Expert,Noise Level: Optimized for User Comfort (<60 dB(A)),"Targeting a low noise level is important for user comfort. The flexibility to tolerate a slightly higher level (<62 dB) if it means using more sustainable sound-dampening solutions is a pragmatic approach that balances user experience with environmental considerations. The emphasis on mitigating potentially irritating high-frequency noise components is also a thoughtful detail that goes beyond just overall decibel levels. However, the PDS should clearly define what constitutes 'sustainable sound-dampening solutions' to ensure this flexibility isn't exploited to use less environmentally friendly materials or processes."
In-Service Expert,"Cost of Ownership: Competitive Pricing & Longevity ($75-$90 initial, $15-$18 brush heads)","While the initial cost and replacement brush head pricing are important for market competitiveness, the true 'cost of ownership' is deeply intertwined with the product's lifespan and the availability/cost of replacement parts. The 7-year product lifespan and competitive replacement costs are positive indicators. However, the sustainability of the materials must be cost-effective without compromising durability or recyclability. If the 'sustainable' materials are significantly more expensive, it could lead to higher initial costs that deter consumers, or necessitate compromises in other areas. The long-term availability of replacement brush heads at the stated price point is also crucial for realizing the intended value proposition."
Circularity Expert,Core Functionality: Optimized Plaque Removal,"While performance is key, the specification doesn't explicitly detail how the sonic vibration technology or bristle dynamics will be designed for longevity and ease of repair. The motor lifespan is mentioned, but the interface and components that might wear out or fail during normal use, beyond the motor itself, are not addressed for repairability. The 'must-have' criterion should also consider the end-of-life implications of its components."
Circularity Expert,Sustainability: Recyclable Mono-Materials & PCR Content,"The commitment to mono-material design and PCR content is excellent. However, the specification for 'specific grades of recyclable polypropylene (PP)' needs to be more precise. Different grades can have varying recyclability and performance. The avoidance of adhesives and ultrasonic welding is commendable, but 'mechanical fasteners (snap-fits, screws)' must be designed for easy manual disassembly without specialized tools to truly facilitate end-of-life processing. The mention of PHA requires a very strong justification for its inclusion, especially regarding its end-of-life pathway and compatibility with existing recycling streams; a clear advantage over PP must be demonstrated, and its 'industrial composting' pathway needs to be robust and widely accessible, not just theoretical."
Circularity Expert,Sustainability: Extended Lifespan & Energy Efficiency,"The target lifespan of 7 years is ambitious and positive. The user-replaceable battery module is a significant step towards reuse and repair. However, the specification for 'secure snap-fits' needs to ensure they are robust enough for repeated user access without degradation, and critically, that they can be operated without tools. The IPX7 sealing maintenance during battery replacement is a challenge that needs detailed design solutions to avoid reliance on adhesives or complex seals that might fail over time or during repair. The Li-ion battery's recyclability is good, but the ease of extracting the battery from its module for recycling needs to be detailed."
Circularity Expert,User Experience: Ergonomic Design & Sustainable Grip,"The avoidance of adhesives for grip accents is crucial. However, the use of natural rubber requires a very clear and verifiable pathway for its separation and recycling or composting at end-of-life, as rubber can be a contaminant in plastic recycling streams. If it cannot be easily separated or if its sourcing is not sustainable, textured PP is a much safer bet for circularity. Minimizing complex tooling is good for waste reduction during manufacturing, but the design must also consider ease of disassembly for repair and end-of-life processing."
Circularity Expert,User Experience: Simplified Controls & LED Feedback,"Designing electronic components and their housing for easy disassembly and recycling using mechanical fasteners is excellent. However, the complexity of the internal electronics, particularly the PCB, and its ability to be easily separated and recycled needs more attention. Are components soldered in a way that allows for easy removal or are they integrated into a larger composite structure?"
Circularity Expert,Durability and Reliability: Robust Construction & Repairability,"The emphasis on mechanical fasteners and avoidance of glues and ultrasonic welding is paramount for circularity. The specification for 'design for disassembly using mechanical fasteners (screws, snap-fits)' must ensure these fasteners are accessible and operable by the end-user or a repair technician without specialized tools. The impact resistance testing is good for durability, but the design should also consider how components might be replaced if they do fail, even if not due to impact."
Circularity Expert,Aesthetics: Minimalist Design with Sustainable Finishes,"Limiting material finishes and types is good for recycling. The use of 'natural dyes or inherent material colors' is excellent. However, if 'low-VOC coatings' are deemed essential, their compatibility with the base material's recyclability and their ability to be easily removed or separated at end-of-life must be thoroughly investigated. Ideally, coatings should be avoided entirely. Minimizing complex designs is good, but this should not come at the expense of ease of disassembly."
Circularity Expert,Power Source: Recyclable Li-ion Battery Module,"The user-replaceable battery module with snap-fits is a strong point for reuse and repair. However, the design needs to ensure that the battery module itself is easily separable into its constituent parts (battery cells, casing) for optimal recycling. The 'responsible battery recycling or take-back program' needs to be robust and easily accessible to consumers. The Li-ion chemistry choice is good, but the focus should also be on the recyclability of the battery's casing and internal components."
Circularity Expert,"Charging Mechanism: Efficient, Recyclable Base","The mono-material PP housing and mechanical fasteners for the charging base are positive. The standby power consumption target is good. The 'cable and connectors to be made from sustainable materials where feasible' needs to be more specific. Are these materials easily separable from the base for recycling? Are they durable enough to not require frequent replacement, which would negate the sustainability benefits?"
Circularity Expert,Brush Head Technology: Mono-Material Housing & Sustainable Bristles,"The mono-material PP housing for the brush head and avoidance of adhesives are excellent. The critical challenge here is the user separation of bristles. 'Design must facilitate user separation of bristles for appropriate disposal' is a strong requirement, but the mechanism for this needs to be clearly defined and easy to use. If bristles are not easily separated, even if made of compostable material, they can contaminate other recycling streams. Home compostable bristles are ideal, but verification and consumer understanding of the process are key. Industrial composting requires a dedicated stream that may not be universally available."
Circularity Expert,Safety: Material Purity & Certified Compliance,"Avoiding harmful substances is crucial. However, the specification should also consider the recyclability of these materials. For instance, if certain food-grade certifications necessitate specific composite materials or treatments, their end-of-life implications must be addressed. Robust sealing is important, but it should not rely on permanent bonding methods that hinder disassembly."
Circularity Expert,Maintenance and Cleaning: Hygienic & Disassemblable Design,"Minimizing crevices and using smooth, non-porous materials is good for hygiene and reduces the need for harsh chemicals. The key here is that 'easy disassembly using mechanical means' must be truly easy for the user or a repair technician. If disassembly for cleaning requires tools or is difficult, users will not perform it, leading to potential hygiene issues or product abandonment."
Circularity Expert,Product Lifecycle Management: Design for Disassembly & Take-Back,"This is the most critical section for circularity. The mandatory use of mechanical fasteners and avoidance of glues/ultrasonic welding is excellent. The 'modular design' concept needs to be explicitly applied to key components like the battery, motor, and electronics to enable easy repair and remanufacturing. The take-back program and logistics are essential for closed-loop systems and must be detailed, including how components will be sorted and processed for reuse, remanufacturing, or high-quality recycling. The instructions for users must be clear and actionable."
Circularity Expert,Cost of Ownership: Competitive Pricing & Longevity,"While cost is important, it should not compromise circularity principles. If sustainable material choices or design for disassembly add a small upfront cost, this should be balanced against the extended lifespan and reduced end-of-life disposal costs. The price of replacement brush heads needs to be considered in the context of their lifespan and recyclability – are they designed for easy disassembly to recover materials?"
Circularity Expert,Noise Level: Optimized for User Comfort,"The tolerance for a slightly higher noise level if unsustainable methods are avoided is a good pragmatic approach. However, the 'sustainable sound-dampening solutions' need to be specified. Are these materials themselves recyclable or compostable? If sound dampening requires composite materials or adhesives, this would be a significant drawback from a circularity perspective. The focus should be on inherent design choices that minimize vibration and noise, rather than adding materials that complicate end-of-life processing."
