Agent Role,Element,Critique
Material & Design Expert,Sustainability: Recyclable Mono-Materials & PCR Content,"The specification prioritizes recyclable mono-materials, which is excellent. However, the reliance on Polypropylene (PP) for the handle, brush head housing, and charging base, while common and recyclable, is derived from non-renewable fossil fuels. While 50% PCR content is a good target, the sourcing and quality assurance of this PCR PP need rigorous documentation to ensure it doesn't compromise performance or introduce contaminants. The mention of PHA as an alternative requires a more robust justification beyond just 'clear performance advantages' and 'cost-effective industrial composting pathway'; its biodegradability claims need to be substantiated with specific certifications and clear end-of-life scenarios for consumers, as industrial composting is not universally accessible. The avoidance of adhesives and ultrasonic welding is commendable for disassembly, but the reliance on mechanical fasteners (snap-fits, screws) needs careful design to ensure long-term durability and water-tightness (IPX7) without degradation over the 7-year lifespan."
Material & Design Expert,Sustainability: Extended Lifespan & Energy Efficiency,"A 7-year product lifespan and battery lifespan of >1000 cycles or 7 years are ambitious and commendable. However, the specification for a 'user-replaceable battery module' with 'secure snap-fits' while maintaining IPX7 sealing is a significant engineering challenge. The long-term integrity of these snap-fits under repeated use and environmental exposure (moisture, temperature fluctuations) needs to be thoroughly validated. The selection of Li-ion battery chemistry with high recycled content is positive, but the 'ethical sourcing' aspect requires more detailed substantiation, as cobalt and lithium mining can have significant environmental and social impacts. A clear plan for battery take-back and recycling is essential, beyond just stating the intention."
Material & Design Expert,User Experience: Ergonomic Design & Sustainable Grip,"The use of natural rubber for grip accents is a good consideration for renewable resources, but the caveat 'if sourcing and end-of-life separation are confirmed' is critical. Natural rubber can be challenging to recycle or compost separately from other materials, and its sourcing can have environmental impacts (deforestation, water use). If not separable, it could hinder the recyclability of the PP handle. Textured PP is a safer, albeit less renewable, alternative. The emphasis on minimizing complex tooling and secondary operations is excellent for reducing waste and cost."
Material & Design Expert,Brush Head Technology: Mono-Material Housing & Sustainable Bristles,"The use of mono-material PP for the brush head housing is good for recyclability. However, the bristles are the most critical component for sustainability here. While castor bean oil-based nylon or cellulose-based polymers are promising, 'certified home compostable' or 'industrial compostable' needs stringent verification. Home compostability is particularly difficult to achieve and maintain in practice for consumer products. The 'design must facilitate user separation of bristles for appropriate disposal' is a key challenge; achieving this separation reliably and easily for the average consumer is often problematic and may lead to incorrect disposal, negating the compostability claims. If separation is not foolproof, the entire brush head will likely end up in landfill or mixed recycling streams."
Material & Design Expert,Safety: Material Purity & Certified Compliance,"The explicit avoidance of BPA, phthalates, heavy metals, and POPs is essential and well-stated. Food-grade certification for oral contact materials is a baseline requirement. However, 'material origins will be scrutinized for potential contaminants' is vague. A more rigorous approach would involve specifying acceptable limits for trace contaminants and requiring supplier certifications. The compliance with IEC 60335, UL 2802, and CE standards is good, but these standards primarily address electrical and functional safety, not necessarily the full lifecycle environmental impact of the materials used."
Material & Design Expert,Product Lifecycle Management: Design for Disassembly & Take-Back,"The mandatory use of mechanical fasteners and prioritization of modular design are excellent for repair, remanufacturing, and recycling. However, the success of a take-back program hinges heavily on consumer participation and the logistical feasibility of collecting, sorting, and processing returned products. The specification needs to detail the partnerships and infrastructure required for 'responsible recycling of all components,' especially batteries and electronics, which often involve hazardous materials and complex recycling processes. Simply stating that logistics will be 'established and detailed' is insufficient at this stage."
Material & Design Expert,Cost of Ownership: Competitive Pricing & Longevity,"While the target lifespan and competitive replacement part costs are good for the consumer, the sustainability goals must be balanced with cost-effectiveness. Using advanced, truly sustainable materials (e.g., high-performance bioplastics, recycled electronics) can sometimes increase Bill of Materials (BOM) costs. The specification needs to ensure that the chosen sustainable materials are not so expensive that they undermine the target initial cost or replacement head pricing, or that the long-term benefits of durability and recyclability are clearly communicated to justify any potential premium."
Material & Design Expert,Noise Level: Optimized for User Comfort,"The target noise level is reasonable. The mention of 'sustainable sound-dampening solutions' is positive, but it's crucial to ensure these solutions are genuinely sustainable and don't introduce new material or end-of-life challenges. The tolerance for a 'slightly higher acceptable level' if unsustainable methods are required highlights a potential trade-off between user comfort and sustainability, which needs careful management and transparent communication to the user."
Production Engineer,Core Functionality: Optimized Plaque Removal,"The performance targets (90% plaque reduction) are ambitious and will require significant R&D investment. While sonic vibration is standard, achieving benchmark performance against leading competitors will necessitate high-quality motor components and precise bristle design. The pressure sensor adds complexity and cost; ensure the feedback mechanism (LED, reduced vibration) is robust and doesn't add significant assembly steps or failure points. The 3N threshold is a good target but needs careful calibration and testing. Dynamic fluid action is a nice-to-have but hard to quantify and prove in production; focus on bristle movement and head design that inherently promotes this."
Production Engineer,Sustainability: Recyclable Mono-Materials & PCR Content,"Prioritizing mono-material PP is sensible for production and recycling. The 50% PCR content target is aggressive and may impact material flow, aesthetics, and mechanical properties. Rigorous testing will be needed to ensure PCR PP meets durability and safety standards, especially for water ingress and impact resistance. Sourcing consistent quality PCR PP at scale can be a challenge. Avoiding adhesives and ultrasonic welding in favor of mechanical fasteners is good for disassembly but increases part count and assembly time/cost. Snap-fits need to be robust enough for a 7-year lifespan and IPX7 rating. PHA is likely too expensive and difficult to process for a mass-market toothbrush; focus on optimizing PP. Clear labeling is simple but requires a robust marking process."
Production Engineer,Sustainability: Extended Lifespan & Energy Efficiency,"A 7-year lifespan for a toothbrush is very long and will be challenging to achieve, especially for the battery and motor. >1000 charge cycles for Li-ion is standard, but degradation over 7 years is a concern. >10,000 hours motor life is also high; ensure the motor is over-specced or has a very conservative duty cycle. The energy targets are achievable with modern components. The user-replaceable battery module is a good sustainability feature but adds complexity to the handle design and sealing mechanism. Tool-less replacement with snap-fits needs to be extremely well-engineered to maintain IPX7 over the product's life. Li-ion battery sourcing with high recycled content is good but can be costly and supply chains need careful vetting."
Production Engineer,User Experience: Ergonomic Design & Sustainable Grip,"The weight and diameter targets are reasonable for injection molding. Ergonomic contours are standard. Using textured PP for grip is the most practical and cost-effective solution; natural rubber presents significant sourcing, cost, and end-of-life separation challenges that likely outweigh its benefits. Minimizing complex tooling and secondary operations is key to cost-effectiveness. Ease of disassembly is good but must be balanced with robust assembly for IPX7 and durability."
Production Engineer,User Experience: Simplified Controls & LED Feedback,"Single power button and mode button is standard and cost-effective. Three modes are manageable. Simple LED indicators are low-cost and reliable. Haptic feedback adds significant cost and complexity (motor, driver circuitry) and should be avoided unless absolutely critical for user adoption. Designing electronics for easy disassembly with mechanical fasteners is good but requires careful integration to maintain sealing and robustness."
Production Engineer,Durability and Reliability: Robust Construction & Repairability,"The 7-year lifespan and 10,000-hour motor life are aggressive targets. The 1-meter drop test onto concrete is a significant challenge for a device with IPX7 sealing and user-replaceable parts. Achieving IPX7 via mechanical seals (O-rings, gaskets) is standard but requires tight tolerances and careful assembly, increasing cost. Reliance on mechanical fasteners for disassembly is good for repair/recycling but must not compromise the integrity of the seals and structural integrity needed for the drop test. Avoidance of glues/ultrasonic welding is good for disassembly but makes achieving robust sealing more challenging."
Production Engineer,Aesthetics: Minimalist Design with Sustainable Finishes,Minimalist design is generally cost-effective. Limiting colors and finishes reduces manufacturing complexity and inventory. Natural dyes can be inconsistent and may affect material properties; inherent material colors are preferred. Low-VOC coatings are unlikely to be necessary and add cost/complexity; focus on material selection. Achieving aesthetics with standard processes is crucial.
Production Engineer,Power Source: Recyclable Li-ion Battery Module,Li-ion is standard. Tool-less user replacement with snap-fits for the battery module is technically challenging to achieve reliably while maintaining IPX7 sealing over the product's life. This will require very precise molding and robust latching mechanisms. Clear communication about recycling is important but relies on user action.
Production Engineer,"Charging Mechanism: Efficient, Recyclable Base",Mono-material PP base with mechanical fasteners is good. Standby power target is achievable. >80% charging efficiency is standard. Sustainable materials for the cable are difficult and costly; standard TPE/PVC is likely more practical and durable. Prioritizing reliability and ease of disassembly is key.
Production Engineer,Brush Head Technology: Mono-Material Housing & Sustainable Bristles,"Mono-material PP housing with snap-fits is standard. The main challenge is the bristles. Castor bean oil-based nylon is common, but 'home compostable' or 'industrial compostable' certification for bristles is extremely difficult and rarely achieved in practice for the required durability and performance. This will likely be a major R&D hurdle and cost driver. Ensuring users can easily separate bristles from the housing for disposal adds complexity to the design and user instructions. A 3-month lifespan is standard."
Production Engineer,Safety: Material Purity & Certified Compliance,"Avoiding BPA, phthalates, etc., is standard for oral care products and requires careful material selection and supplier vetting. Food-grade certification is essential. Compliance with IEC 60335, UL 2802, and CE is mandatory and requires significant testing and documentation, adding cost. Thermal cut-offs and robust sealing are standard safety features but must be integrated without compromising disassembly or IPX7."
Production Engineer,Maintenance and Cleaning: Hygienic & Disassemblable Design,"Smooth, non-porous materials are standard. Minimizing crevices is good design practice. Easy disassembly for cleaning is covered by the overall design for disassembly requirement, but specific features for brush head connection need to be robust yet easy to manipulate. Material resistance to microbial growth is a function of material choice (PP is generally good)."
Production Engineer,Product Lifecycle Management: Design for Disassembly & Take-Back,"Mandatory mechanical fasteners are good but increase part count and assembly complexity. Modular design is excellent but needs careful implementation to avoid compromising sealing and durability. Clear instructions are essential but rely on user compliance. Establishing logistics for a take-back program is a significant operational and cost undertaking, requiring partnerships and infrastructure."
Production Engineer,Cost of Ownership: Competitive Pricing & Longevity,"The target initial cost ($75-$90) is at the higher end for electric toothbrushes, which may be justified by the sustainability features if executed well. Replacement brush head pricing is competitive. The 7-year lifespan is the key to a good TCO, but achieving this reliably is the main production challenge. Balancing BOM cost with lifespan and recyclability is the core production engineering task; sustainability features often increase upfront costs."
Production Engineer,Noise Level: Optimized for User Comfort,"Targeting <60 dB(A) is achievable with good motor and acoustic design, but adds cost. Sustainable sound-dampening solutions are vague; standard methods (material choice, internal baffling) are preferred. Tolerating <62 dB is pragmatic if <60 dB is prohibitively expensive. Frequency analysis is a standard part of motor development, but focus on the overall sound profile rather than getting lost in minutiae."
In-Service Expert,Product use time/lifetime (7 years target),"The target lifespan of 7 years for the toothbrush and battery is a good starting point for reducing environmental impact. However, the definition of 'lifespan' needs to be more robust. Does this mean functional failure, or a decline in performance to a point where it's no longer effective? For example, if the battery capacity significantly degrades after 4 years, even if it technically 'works,' users might be inclined to replace the entire unit, shortening its actual use time. Clearer metrics for performance degradation over time are needed. Furthermore, while a 7-year battery life is ambitious, the reality of Li-ion batteries is that their capacity diminishes over time. The design should consider how a user might perceive a 'worn-out' battery, and if a gradual, noticeable decrease in performance would prompt replacement. The design for tool-less battery replacement is excellent for extending the product's useful life, but the availability and cost of replacement batteries are critical for realizing this 7-year goal. If replacement batteries are prohibitively expensive or difficult to source, the 7-year target becomes aspirational rather than practical."
In-Service Expert,Energy consumption during use (<0.3 Wh per 2-minute cycle),"The target for energy consumption per brushing cycle is commendably low, indicating a focus on efficiency. However, the overall energy footprint extends beyond the brushing cycle itself. The charging base's standby power consumption (<0.5W) is also a positive step, but this is still a constant drain when plugged in. While this is a common challenge for many electronic devices, further investigation into ultra-low standby power modes or even 'smart' charging that only activates when the battery is critically low could further reduce energy waste. Additionally, the energy required for manufacturing the toothbrush, especially the battery and motor, should be considered in a holistic lifecycle assessment. While this PDS focuses on in-use energy, a truly sustainable product would also account for embodied energy. The efficiency of the charging mechanism (>80%) is good, but optimizing this further, even by a few percentage points, can contribute to overall energy savings over the product's lifetime."
In-Service Expert,"Robustness, reliability, and maintenance (7-year target, >10,000 hours motor, >1000 cycles battery, impact resistance, IPX7)","The emphasis on robustness, reliability, and repairability is a significant strength of this design. The target lifespans for the motor and battery, coupled with the impact resistance and IPX7 rating, suggest a product built to last. The design for disassembly using mechanical fasteners is crucial for enabling repair and end-of-life processing, directly addressing the negative environmental impact of malfunctioning products. However, the 'maintenance' aspect needs further clarification. While the design minimizes crevices for easier cleaning, the PDS doesn't explicitly detail routine maintenance beyond cleaning the exterior and brush head. For instance, are there any internal components that might require periodic cleaning or checks to ensure optimal performance and longevity? The user-replaceable battery is a key maintenance feature, but the ease of this process, especially maintaining the IPX7 seal, will be critical. If the process is complex or prone to user error, it could lead to water ingress and product failure, negating the repairability benefit. Clear, step-by-step instructions and perhaps even video guides for battery replacement will be essential for ensuring the intended maintenance is performed correctly."
In-Service Expert,"Sustainability: Recyclable Mono-Materials & PCR Content (PP, 50% PCR, mechanical fasteners, no adhesives/welding)","The commitment to recyclable mono-materials, specifically polypropylene (PP), and the inclusion of 50% post-consumer recycled (PCR) content are excellent steps towards reducing the environmental impact of the product's materials. Prioritizing mechanical fasteners over adhesives and ultrasonic welding is a critical design choice that significantly aids in disassembly for repair and recycling, aligning perfectly with repair rights and circular economy principles. However, the 'provided performance and safety are not compromised' caveat for PCR content needs rigorous validation. It's essential to ensure that the PCR PP maintains the necessary durability, water resistance, and structural integrity for a 7-year product lifespan, especially in a bathroom environment. The documentation of material origins is also a positive step for transparency. The clear labeling of plastic components with recycling codes is a user-friendly practice. The mention of PHA as an alternative requires a very clear and demonstrable advantage, not just in compostability but also in its overall lifecycle impact relative to PP, including manufacturing and end-of-life processing infrastructure availability. The 'cost-effective industrial composting pathway' is a significant hurdle for many bioplastics."
In-Service Expert,"Brush Head Technology (Mono-material PP, castor bean oil-based/cellulose bristles, home/industrial compostable)","The focus on a mono-material PP housing for the brush head and the use of bio-based or compostable bristles are commendable. The design facilitating user separation of bristles is a crucial step towards proper disposal. However, the 'home compostable' certification (TUV Austria OK Compost Home) is a very high bar and often difficult to achieve in practice for consumers, as composting conditions vary widely. Industrial composting (ASTM D6400) is more reliable but relies on accessible industrial composting facilities, which are not universally available. The PDS needs to clearly define the expected end-of-life pathway for the bristles and ensure that users have clear, actionable instructions on how to achieve it. If home composting is the primary target, the product's success hinges on user education and consistent composting practices. The performance verification of these alternative bristles against conventional ones is also critical to ensure user satisfaction and prevent premature replacement, which would negate sustainability efforts."
In-Service Expert,Product Lifecycle Management (Design for Disassembly & Take-Back),"The mandatory use of mechanical fasteners and the prioritization of modular design are foundational for effective product lifecycle management, enabling repair, remanufacturing, and recycling. This directly supports the end-user's right to repair and extends product life. The commitment to providing clear instructions for take-back programs and establishing logistics for responsible recycling is vital. However, the success of a take-back program hinges on its accessibility, user participation, and the actual effectiveness of the recycling process. It's important to ensure that the 'responsible recycling' is truly effective and doesn't simply shift the environmental burden elsewhere. The PDS should ideally include details on how the collected products will be processed, prioritizing material recovery and reuse where possible. The cost and logistics of such a program also need to be factored in to ensure its long-term viability."
In-Service Expert,"User Experience: Ergonomic Design & Sustainable Grip (120-150g, 25-35mm diameter, natural rubber/textured PP, no adhesives)","The focus on ergonomic design and the avoidance of adhesives for grip accents are positive. Using natural rubber, if sourced responsibly and with a clear end-of-life separation strategy, could be a sustainable choice. However, the 'textured PP' alternative is more readily recyclable. The key challenge here is ensuring that the chosen grip material and texture provide sufficient grip, especially in a wet bathroom environment, without compromising the product's overall recyclability. The statement 'Design will minimize complex tooling and secondary operations to reduce cost and waste' is excellent. Ease of disassembly for cleaning and repair is reiterated here, which is crucial for user experience and product longevity."
In-Service Expert,"Power Source: Recyclable Li-ion Battery Module (Tool-less replacement, snap-fits, IPX7 seal, responsible recycling)","The design for a user-replaceable Li-ion battery module with tool-less replacement via secure snap-fits is a standout feature for extending product lifespan and empowering users. Maintaining the IPX7 seal during replacement is a critical engineering challenge that must be rigorously tested and validated. The emphasis on high recycled content and recyclability of the battery chemistry is excellent. However, the 'responsible battery recycling or take-back program' needs concrete details. Users need to know *how* to return batteries and what to expect. The lifespan target of >1000 charge cycles or 7 years is ambitious for Li-ion batteries, and the design should account for potential performance degradation within this timeframe, ensuring it doesn't lead to user frustration or premature disposal. The availability and cost of replacement batteries will be a primary driver of whether this feature is truly utilized."
In-Service Expert,"Charging Mechanism: Efficient, Recyclable Base (<0.5W standby, mono-material PP, mechanical fasteners)","The design of the charging base with mono-material PP, mechanical fasteners for disassembly, and low standby power consumption (<0.5W) is well-aligned with sustainability goals. The focus on reliability and ease of disassembly for recycling is also positive. However, the 'cable and connectors to be made from sustainable materials where feasible' is a bit vague. It's important to specify what 'sustainable materials' are considered and to ensure their durability and safety. Often, cables are a point of failure, so their longevity is as important as their material composition. The efficiency of the charging mechanism (>80%) is good, but continuous improvement in this area, even small gains, contributes to overall energy savings."
In-Service Expert,"Safety: Material Purity & Certified Compliance (No BPA, phthalates, heavy metals, food-grade, IEC 60335, UL 2802, CE)","The explicit avoidance of harmful substances like BPA, phthalates, and heavy metals, along with the requirement for food-grade certification for oral contact materials, is fundamental for user safety and health. Scrutinizing material origins for contaminants is a crucial step in ensuring purity. Compliance with relevant safety standards (IEC 60335, UL 2802, CE) is non-negotiable. The inclusion of thermal cut-offs and robust sealing further enhances electrical safety. This section demonstrates a strong commitment to user well-being, which is paramount for any product, especially one used daily in the mouth."
