PDS Element,Critique
Primary Function: Efficient and Sustainable Lawn Mowing,"While 'efficiency' is mentioned, the PDS lacks specific quantifiable metrics for mowing efficiency. For instance, 'area mowed per kWh' or 'time to mow a standard 100 sq meter lawn' would provide clearer targets.; The justification for sustainability is strong, but it could be further enhanced by specifying targets for embodied energy reduction in materials and manufacturing, or a target for the percentage of recycled content.; The 'desired height' for mowing is subjective. The PDS should specify a target range or a standard for 'well-maintained lawn' to ensure consistency in performance expectations."
Target User: Homeowners and Small-Scale Landscapers,"The distinction between 'homeowners' and 'small-scale landscapers' is important. The PDS should consider if a single product can effectively serve both. Landscapers may require higher durability, faster charging, and potentially larger battery capacities than typical homeowners.; While 'ease of use' is mentioned, specific metrics or features that define 'intuitive operation' for users with 'no extensive technical expertise' are not detailed. This could include aspects like one-button start, clear indicator lights, or simple tool-less adjustments.; The PDS should consider the operational environment for landscapers, which might involve longer working hours, more frequent use, and potentially rougher terrain than a typical residential lawn."
Performance: Cutting Width and Height Adjustment,"A cutting width of 'at least 46 cm' is a good starting point, but the PDS could benefit from specifying a maximum acceptable weight for the mower given this width, to ensure maneuverability.; The range of cutting heights (2.5 cm to 7.5 cm) is standard. However, the PDS should specify the tolerance or accuracy of the height setting. For example, 'within +/- 0.5 cm of the selected height'.; The 'single-point adjustment system' is a good suggestion for ease of use. The PDS should also consider the force required to adjust the height and the durability of the adjustment mechanism under repeated use."
Performance: Mulching and Bagging Capabilities,"The PDS states 'at least two primary options'. It would be beneficial to specify the efficiency of mulching. For example, 'mulch clippings into pieces smaller than X mm' or 'achieve a mulching fineness that is visually indistinguishable from clippings left on the lawn'.; The 'generous capacity' for the bag is vague. A specific volume (e.g., 50 liters) should be specified, along with a target fill level before emptying is recommended.; The ease of attachment/detachment of the bag is crucial. The PDS could specify a maximum time or number of steps required for this operation."
Power Source: Electric (Battery-Powered),"The PDS specifies '40V or 60V' and 'at least 4.0 Ah'. This needs to be translated into a target runtime. For example, 'sufficient runtime to mow X square meters on a single charge' or 'a minimum of 45 minutes of continuous operation'.; The charging time for the battery should also be specified. For example, 'a full charge within X hours' or 'an 80% charge within Y minutes' to accommodate users who may need to swap batteries or recharge quickly.; The PDS mentions 'optimal energy density, lifespan, and charging speed' for Li-ion batteries. Quantifiable targets for cycle life (e.g., 500-1000 cycles) and charging speed should be included."
Sustainability: Materials and Manufacturing,"Specifying 'recycled or recyclable plastics' is good, but the PDS could go further by setting a target percentage for recycled content (e.g., 'minimum 75% recycled HDPE').; The PDS should define what constitutes 'minimal use of virgin plastics and non-recyclable materials'. This could be a percentage target or a list of prohibited materials.; For the cutting blade, 'high-strength, durable steel' is mentioned. The PDS could specify a hardness or tensile strength requirement, and also a target for the number of sharpenings before replacement is recommended."
Sustainability: Energy Efficiency and Longevity,"Quantifying 'highly efficient' motor is important. This could be expressed as a percentage of energy converted to mechanical work, or a benchmark against other electric mowers.; The PDS mentions 'easily replaceable wear parts'. It should specify which parts are considered wear parts and the expected lifespan of each before replacement is necessary.; Design for repairability is mentioned. The PDS could outline specific repairability targets, such as 'average repair time of under 30 minutes' or 'availability of spare parts for at least 7 years post-production'."
Sustainability: End-of-Life Management,"While 'easy disassembly' is stated, the PDS could specify a target for the time it takes to disassemble the product for recycling, or the number of tools required.; Clear labeling of materials is good. The PDS could specify the standard or format for this labeling (e.g., ISO 11469)."
Ergonomics and Usability: Handle and Controls,"The PDS mentions 'ergonomically designed for comfortable grip and reduced vibration'. Quantifiable metrics for vibration reduction (e.g., ISO 2631 standard) would be beneficial.; The 'intuitive, easily accessible' controls need further definition. For example, 'all primary controls operable with a single hand' or 'visual feedback for control activation'.; The PDS should specify the required force to operate the safety bail lever and the response time for blade and motor stop upon release."
Ergonomics and Usability: Mobility and Storage,"While 'lightweight and maneuverable' are desired, specific weight targets should be set. For example, 'maximum weight of X kg including battery'.; The 'folding handle mechanism' should have a defined ease of use. For instance, 'foldable/unfoldable in under 30 seconds with no tools required'.; The PDS could specify the dimensions of the mower when folded to ensure it fits within typical storage spaces."
Safety Features,"The PDS mentions 'Blade brake clutch (BBC) or equivalent'. The stopping time for the blade should be specified (e.g., 'blade stops within 3 seconds of BBC activation').; The PDS should specify the type of overload protection (e.g., electronic, thermal) and the conditions under which it activates.; Compliance with specific safety standards (UL, CE) is good. The PDS should list the exact standards and clauses that the product must meet."
Durability and Reliability,"The 'projected lifespan of at least 5 years' for key components is a good target. However, this should be tied to a usage profile (e.g., '5 years or 500 hours of operation, whichever comes first').; The PDS mentions withstanding 'typical outdoor use and environmental conditions'. This could be more specific by defining acceptable levels of dust ingress (e.g., IP rating) and moisture exposure.; The temperature range is specified. The PDS could also consider humidity levels and UV exposure resistance for materials."
Noise Level,"The target of 'below 75 dB(A)' is a good benchmark. The PDS should specify the measurement conditions (e.g., distance from operator, mowing conditions) for this measurement.; It would be beneficial to also consider noise emitted to the surroundings, not just at the operator's ear, especially for suburban environments."
Maintenance Requirements,"The PDS correctly highlights the reduced maintenance compared to gas mowers. However, it could specify the frequency of these minimal tasks. For example, 'blade sharpening recommended every 25 hours of use' or 'cleaning the deck after each use'.; The PDS should define what constitutes 'checking battery health' and provide guidance on how users can do this."
Aesthetics and Design Language,"While 'modern, clean, and appealing' are subjective, the PDS could provide more concrete direction. For example, 'minimal visible fasteners', 'smooth transition between surfaces', or 'a specific aesthetic theme like 'organic minimalism''.; The color palette suggestion is good. It could be further refined by specifying a primary and secondary color ratio or providing example mood boards."
Cost and Value Proposition,"The PDS mentions 'competitive within the premium electric mower market'. A target price range or a specific competitor's price point to benchmark against would be more concrete.; The 'lower total cost of ownership' needs to be quantified. This could be presented as a percentage saving over 5 years compared to a comparable gas mower, considering fuel, maintenance, and electricity costs.; The value proposition is well-articulated. The PDS could also consider a warranty period that supports the longevity claims."
Battery System Compatibility,"If compatibility is a goal, the PDS should explicitly state which other tools or devices the battery will be compatible with. This provides a clearer scope for the battery system design.; The PDS should also specify the physical and electrical interface requirements for the battery system to ensure seamless integration."
Weather Resistance,"The PDS states 'occasional exposure to light rain or dew' and 'not operated in heavy rain'. This implies a need for an IP rating. A specific target IP rating (e.g., IPX4 for splash resistance) should be defined for the electrical components and battery housing.; The PDS should clarify the acceptable storage conditions beyond just 'not stored outdoors uncovered'. For example, 'must be stored in a dry environment between -10°C and 50°C'."
