Conflict,Decision,Rationale
"Material & Design Expert suggests bio-based materials like bamboo for structural elements, while Production Engineer and Circularity Expert raise concerns about their durability, integration with plastics, and potential to create composite waste streams that hinder recycling.","Prioritize established, durable, and easily recyclable materials. Limit bio-based materials to non-structural, easily separable components where their sustainability benefits are clear and their end-of-life is managed.","Engineering feasibility and sustainability of recycling are paramount. Bamboo's long-term durability in a high-stress tool and its integration with plastics pose significant risks to product lifespan and end-of-life recyclability, potentially creating unrecyclable composites. Focusing on well-understood recycled plastics and metals ensures manufacturability and recyclability."
"Material & Design Expert and In-Service Expert suggest aiming for longer lifespans (7-10 years) and higher durability (e.g., improved IP rating beyond IP54), while Production Engineer and Cost/Affordability considerations highlight that aggressive durability targets (like a 1.5m drop test) and higher IP ratings add significant cost, complexity, and manufacturing challenges.","Target a 7-year operational lifespan and maintain IP54 rating. Focus on robust design for key components and modularity for repair, rather than extreme impact resistance or higher sealing.","A 7-year lifespan is a strong sustainability goal that balances ambition with feasibility. While higher IP ratings and extreme drop resistance would increase longevity, they also significantly increase manufacturing cost and complexity, potentially making the product unaffordable or less competitive. Focusing on modularity and repairability provides a more cost-effective path to extending product life."
"Circularity Expert and Material & Design Expert advocate for user-replaceable batteries and easy disassembly for repair, while Production Engineer expresses concerns about the complexity, cost, and potential for compromising sealing or structural integrity if not designed carefully.","Design for user-replaceable batteries and easy disassembly using standard fasteners, but ensure robust sealing and structural integrity through careful design and material selection.","User-replaceable batteries are crucial for extending product life and enabling repair, a core tenet of circularity. While it adds some complexity, it is feasible with good design. The key is to ensure that the design doesn't compromise other critical aspects like sealing or durability. This requires careful engineering rather than outright avoidance."
"Material & Design Expert and In-Service Expert suggest incorporating features like software updates for drills, while Production Engineer and Circularity Expert view this as unnecessary complexity, cost, and a potential source of obsolescence.",Exclude software update functionality for the drill itself. Focus on mechanical robustness and repairability.,"Software updates are generally not relevant for a mechanical tool like a drill and introduce unnecessary complexity, cost, and potential for obsolescence. The focus should remain on durable mechanical design and repairability, aligning with sustainability goals."
"Circularity Expert and Material & Design Expert emphasize minimizing adhesives and using snap-fits for easy disassembly, while Production Engineer and Material & Design Expert note that snap-fits can compromise durability and sealing, and adhesives are often necessary for robust assembly.","Minimize the use of permanent adhesives and explore snap-fits where they do not compromise durability, sealing, or structural integrity. For critical joins, prioritize easily removable mechanical fasteners.","While snap-fits are ideal for disassembly, they can compromise product integrity in demanding applications. A balanced approach is needed: avoid permanent adhesives where possible, use snap-fits judiciously, and rely on mechanical fasteners for critical connections. This ensures both disassembly and product robustness."
"Material & Design Expert and In-Service Expert suggest offering a range of models to 'right-size' tools for consumers, while Production Engineer and Cost/Affordability considerations emphasize the need for economies of scale and cost-effectiveness, which can be hindered by too many product variations.","Focus on a single, versatile, and well-engineered model that balances performance for common DIY tasks, rather than offering a wide range of specialized models.","While 'right-sizing' is conceptually good for resource efficiency, offering multiple specialized models increases manufacturing complexity, reduces economies of scale, and can lead to higher costs. A single, robust, and repairable model designed for the majority of DIY tasks offers a better balance of sustainability, cost, and market reach."
