Conflict,Decision,Rationale
"Material & Design Expert prioritizes high-strength composites for frame for performance, while Circularity Expert strongly advises against composites due to recyclability issues, preferring recycled aluminum.",Prioritize recycled aluminum alloys for the frame.,"Engineering feasibility and sustainability are prioritized. While composites can offer high strength-to-weight ratios, their poor recyclability poses a significant end-of-life challenge, directly contradicting the sustainability and circularity goals. Recycled aluminum offers a more sustainable and recyclable alternative, and its properties can be engineered to meet performance requirements with appropriate alloy selection and design."
"Production Engineer highlights the complexity and cost of highly adjustable components for ergonomics, while Material & Design Expert and In-Service Expert emphasize the need for adaptability and comfort for diverse users.","Implement standardized adjustment ranges with a focus on modularity for key ergonomic features, offering a limited number of pre-configured sizes or packages.","This balances the need for user comfort and adaptability with production feasibility and cost. Overly complex, infinitely adjustable components increase manufacturing complexity, cost, and potential failure points. Standardized ranges and modular options allow for optimization during production while still catering to a significant portion of the user base. This also supports maintainability by allowing specific modules to be replaced if needed."
"Material & Design Expert suggests advanced bio-materials for cushioning for sustainability, while Production Engineer raises concerns about their durability, washability, and inconsistent properties.","Utilize durable, high-density recycled foam with natural fiber blends (e.g., organic cotton, hemp) for cushioning, ensuring these materials meet specified durability and washability standards.","This decision balances the sustainability of recycled and natural materials with the practical requirements of durability and ease of maintenance for in-service use. While some advanced bio-materials might be highly sustainable, their performance in a demanding application like a wheelchair needs to be proven. Recycled foam and proven natural fibers offer a more reliable and maintainable solution that aligns with sustainability goals."
"Circularity Expert strongly advises against composite materials for the frame due to recyclability issues, while Material & Design Expert notes their potential for high strength and specific performance requirements like obstacle clearance.","Prioritize recycled aluminum alloys for the frame and explore high-strength, easily recyclable polymers or metals for specific components requiring high impact resistance or complex shapes, ensuring these materials are specified with clear end-of-life recycling pathways.","This decision aims to maximize sustainability by favoring easily recyclable materials like aluminum for the primary structure. For components where composites might offer unique advantages, the focus shifts to ensuring those materials are selected with recyclability in mind or that alternative, more recyclable materials can meet the performance needs. This acknowledges the performance demands while strictly adhering to circularity principles."
"Production Engineer notes that designing for future connectivity and smart features upfront significantly increases initial complexity and cost, while Material & Design Expert and Circularity Expert see value in future-proofing and modularity for extended product life.","Design the core product with robust internal pathways and mounting points for potential future upgrades, but keep the primary electronics and smart features as modular add-on options or for future product generations.","This approach balances the desire for future-proofing and modularity with the immediate concerns of production complexity and cost. By incorporating provisions for future upgrades without fully integrating complex electronics from the outset, the initial design remains more streamlined and affordable. This allows for innovation in smart features to be developed and integrated more effectively in later iterations or as distinct upgrade modules, which can also be designed with circularity in mind."
