Conflict,Decision,Rationale
"Material & Design Expert wants to use composite structures for structural elements for potential weight/strength benefits, but Production Engineer and Material & Design Expert also highlight recyclability issues with composites and prioritize mono-materials for structural elements.",Prioritize mono-materials (recycled aluminum alloys) for structural elements and avoid composite structures.,"Recyclability is a core sustainability goal, and composite structures pose significant challenges for effective recycling at end-of-life. Mono-materials, especially widely recyclable ones like aluminum, are far more feasible for a circular economy. Engineering feasibility and sustainability are prioritized."
"Material & Design Expert and Production Engineer emphasize the need for detailed specificity on recycled material origins and certifications, while Production Engineer also notes the difficulty and potential cost of achieving high recycled content targets (>50% aluminum, >70% plastic) at scale.","Mandate high recycled content targets and require detailed specificity on origins and certifications, accepting potential cost implications.","Achieving ambitious recycled content targets is critical for true material sustainability. While challenging, it drives innovation in supply chains and material sourcing. Specificity ensures claims are verifiable and avoids 'greenwashing'. Engineering feasibility is assumed to be solvable with sufficient R&D and supplier engagement, and sustainability is the primary driver."
"Material & Design Expert wants to minimize the number of material types used, while Production Engineer notes that modularity for tiered features and user needs (e.g., different control modules for cognitive vs. mobility impairments) can add complexity and part count.","Prioritize minimizing material types within modules and for the core structure, while allowing for modularity for user needs, ensuring modules themselves are designed with material minimization and recyclability in mind.","The goal is to balance the need for diverse functionality and user adaptation with the overarching sustainability principle of material simplification for recycling. Modularity can enhance product longevity and repairability, which are also sustainability benefits. The key is that each module adheres to material reduction and recyclability principles."
"Production Engineer highlights the difficulty and cost of achieving robust mobility requirements (10-degree incline, 150kg load, 1.5m turning radius) which may lead to complex, heavier, or more expensive solutions, potentially conflicting with weight optimization and affordability.","Maintain the mobility performance requirements and prioritize engineering solutions that optimize weight and cost within these constraints, focusing on efficient design and material selection.","Mobility performance is a fundamental user requirement for an electric wheelchair. While challenging, engineering feasibility should be pushed to meet these needs sustainably. Prioritizing weight optimization and cost-effectiveness through smart design rather than compromising core functionality is key. Sustainability includes product longevity and user satisfaction, which are tied to performance."
"Production Engineer notes that advanced features like regenerative braking, robust mobility, and high recycled content are costly and may conflict with affordability targets.","Prioritize sustainability features (regenerative braking, high recycled content) and robust performance over aggressive cost reduction that compromises these goals.","The product's core value proposition includes sustainability. While affordability is important, compromising key sustainability features or performance for minor cost savings would undermine the product's purpose. Lifecycle cost of ownership and long-term value should be emphasized."
"Circularity Expert points out that 'robust wheel and suspension designs' could lead to over-engineering and difficulty in disassembly, while In-Service Expert and Production Engineer emphasize the need for robustness and reliability for a 10+ year lifespan.",Design for robust performance and longevity using materials and assembly methods that also facilitate disassembly for repair and recycling.,"Durability and reliability are essential for a product intended to last over 10 years, ensuring user safety and reducing premature replacement. However, this must be achieved through design choices that enable easy repair and eventual disassembly, rather than relying solely on over-engineering that hinders circularity. The focus should be on smart design and material selection that balance strength with serviceability."
"Material & Design Expert and Circularity Expert emphasize material passports and detailed DFD principles for transparency and end-of-life management, while Production Engineer notes the administrative overhead and potential cost.","Mandate the implementation of material passports and detailed DFD principles, recognizing the need for efficient implementation to manage overhead.","Transparency and detailed design for disassembly are critical for achieving true circularity and robust end-of-life management. While there is an administrative cost, the long-term benefits for sustainability, compliance, and resource recovery outweigh this. The goal is to integrate these processes efficiently into the design and production workflow."
"Circularity Expert and Material & Design Expert advocate for avoiding glues/adhesives and using non-permanent fasteners for easy disassembly, while In-Service Expert and Production Engineer highlight the need for robustness, sealing, and durability over a 10+ year lifespan, which can sometimes be achieved with more permanent joining methods.","Prioritize non-permanent fasteners and the avoidance of glues/adhesives for all user-accessible and repairable components, and for structural elements where feasible. For critical sealing or highly stressed joints, explore advanced mechanical fastening or reversible joining technologies.","Ease of disassembly for repair and recycling is a primary sustainability goal. While some applications may require robust sealing or extreme durability, the default should be non-permanent methods. Engineering innovation should focus on achieving the required performance with reversible joining technologies to maintain circularity principles."
