Element,Critique
Material Selection,"Prioritize post-consumer recycled (PCR) content for external casings and non-critical components. For critical internal components (e.g., heating element housing, pump parts) that require high performance, specify virgin, food-grade materials that are known to be highly recyclable (e.g., specific grades of stainless steel, high-performance polymers). Avoid composite materials. Clearly define the types of bio-based plastics and sustainable wood alternatives, ensuring they are food-grade, durable, and have clear end-of-life pathways (recyclable or industrially compostable). Minimize the variety of plastic types used to simplify end-of-life processing. Specify FSC-certified or reclaimed timber. Ensure all materials are BPA-free and food-grade."
Energy Efficiency,"Specify materials for the heating element and insulation that are durable and non-toxic. Define quantitative targets for standby power consumption (e.g., < 1W) and sleep mode. The heating system should prioritize heating only the required water volume on demand rather than maintaining a large reservoir at temperature. Implement user-configurable auto shut-off periods. Ensure the companion app (if used) has a low energy footprint and provides actionable insights for energy reduction."
Water Usage,"Design internal tubing and water-contact components using materials that are inert, food-grade, and resistant to mineral buildup and leaching. Explore integrated water filtration systems using long-lasting, cleanable filter media or easily replaceable, compostable filters with clear home or industrial compostability certification. Provide clear, integrated UI/UX guidance on water usage and conservation."
End-of-Life Management & Durability,"Design for disassembly using standard fasteners (screws) and minimal, non-aggressive snap-fits. Clearly label all major components with their material type (e.g., ABS, PP, Aluminum). Target a minimum product lifespan of 10 years, with key wear-and-tear components (pump, seals, heating element) designed to be user-replaceable with common tools. Ensure spare parts are readily available for at least 10 years. Design for modularity where possible to facilitate repair and potential upgrades. Implement a take-back program with clear instructions for consumers and efficient logistics for material recovery and reuse."
Production & Manufacturing,"Simplify the design by focusing on ground coffee brewing only; eliminate pod compatibility. For multiple brewing methods (espresso, drip), explore modular design solutions that allow for easier assembly and potential future upgrades or replacements. Use standard tooling and processes where possible. If offering multiple color options, explore finishes that minimize additional processing steps or material waste. Ensure manufacturing processes utilize renewable energy sources and minimize waste and water consumption, with verifiable metrics."
User Interface & Experience (UI/UX),"Prioritize a simple, robust, and intuitive user interface, leaning towards physical controls for core functions. If smart features are included, make them modular and optional. Focus on essential data display (e.g., energy consumption, maintenance reminders) and avoid complex remote brewing functionalities that add cost and complexity. Ensure any companion app is lightweight and energy-efficient."
Maintenance & Cleaning,"Design all removable parts to be easily cleaned by hand and dishwasher-safe, made from durable, single materials. Minimize complex internal components; ensure any components requiring cleaning or maintenance are easily accessible. Integrate automated cleaning cycles or prompts that use eco-friendly cleaning agents or primarily water, and provide clear instructions for manual cleaning. Ease of cleaning should directly support ease of repair."
Packaging,"Utilize 100% recyclable or home-compostable packaging materials such as molded pulp or recycled cardboard. Minimize packaging volume and weight. Use soy-based or vegetable-based inks. Clearly label packaging with recycling or composting instructions, using clear iconography. Ensure packaging provides adequate product protection without excessive material use."
Ethical Sourcing & Manufacturing,"Substantiate 'ethical sourcing' and 'fair labor practices' with specific third-party certifications (e.g., Fair Trade, SA8000) or a detailed supplier code of conduct. Quantify targets for carbon footprint reduction in manufacturing and transportation, and outline strategies for achieving them (e.g., renewable energy in factories, optimized logistics). Ensure transparency in the supply chain and consider communicating this to consumers."
