PDS Element,Critique
Target User Profile,"The target user profile is well-defined and aligns with the product's sustainability focus. However, it could be further refined by segmenting the 'environmentally conscious consumer' into more specific archetypes (e.g., the busy professional needing quick, sustainable coffee vs. the coffee connoisseur seeking ethical, high-quality brews). This could inform feature prioritization.; While 'moderate to high disposable income' is mentioned, providing a more concrete price range expectation for the machine itself would help validate this assumption and guide cost considerations.; The 'digitally savvy' aspect is noted, but the extent of desired digital integration (beyond optional smart features) is not explicitly stated, which could lead to feature creep or under-delivery.; The secondary user profile for small offices/co-working spaces is a good addition, but their specific needs (e.g., higher volume brewing, ease of maintenance for multiple users) should be considered and potentially differentiated from the primary user's needs."
Primary Functionality: Coffee Brewing,"The requirement for 'high-quality coffee' is subjective. Defining specific quality metrics (e.g., taste profiles, aroma, crema consistency) and how they will be measured and ensured would strengthen this element.; The range of brewing options is good, but the PDS should specify which options are considered 'core' and which are 'desirable'. For example, is drip coffee as critical as espresso for the target user?; The 'under 60 seconds for a standard cup' is a good benchmark, but it needs to be clarified if this includes pre-heating time or just brewing time. Consistency across different brewing types should also be considered.; The temperature range of 90-96°C is standard, but the PDS should consider if the machine will offer user-adjustable temperature settings for different coffee types or bean roasts.; The 9-bar pressure for espresso is standard, but the PDS should consider if the machine will have a pump that can consistently maintain this pressure, especially over time and with varying water temperatures. Also, mention the importance of pre-infusion for espresso quality."
Sustainability: Material Selection,"While prioritizing recycled and recyclable materials is excellent, the PDS should specify target percentages for recycled content for key components (e.g., >70% recycled plastic for housing).; The mention of 'bio-based plastics or sustainable wood alternatives' is positive, but specific types and their certifications (e.g., FSC for wood, specific bio-plastic standards) should be considered to ensure genuine sustainability.; The avoidance of single-use plastics in packaging is a strong point. However, the PDS should also address potential single-use components within the machine's operation (e.g., if pod-based, what is the pod material and its end-of-life solution?).; Defining 'durable' and 'long lifespan' with specific metrics (e.g., number of brewing cycles, warranty period) would make this requirement more measurable.; The 'food-grade and free from harmful chemicals' is essential. Specifying adherence to relevant regulations (e.g., FDA, EU food contact materials) would add rigor."
Sustainability: Energy Efficiency,"Aiming for ENERGY STAR certification is a good goal. The PDS should also outline specific target energy consumption figures (e.g., kWh per year, standby power consumption in Watts) to guide design.; The automatic shut-off time (15-30 minutes) is reasonable, but the PDS could explore user-configurable shut-off times to cater to different usage patterns.; The 'efficient heating element' needs to be specified. Are we looking at induction heating, or a more advanced thermal block system? The PDS should consider the trade-offs in efficiency, cost, and heating speed.; The 'sleep mode' is a good idea. The PDS should define the transition time to sleep mode and the power consumption in this mode.; Providing energy consumption data is valuable. The PDS should specify how this data will be presented (e.g., on the display, via an app, a simple indicator light) and what metrics will be shown (e.g., estimated daily/monthly usage, cost savings)."
Sustainability: Water Usage,"The PDS should quantify 'optimize water heating and dispensing to minimize waste'. This could involve specifying a maximum volume of water heated per brew cycle or a target for water recovery from the brew process.; For descaling and maintenance, the PDS should consider if the machine will incorporate any self-cleaning features that reduce the need for manual intervention and potential water waste during cleaning.; The exploration of water filtration options is good. If disposable filters are unavoidable, the PDS should mandate compostable or easily recyclable filter materials.; Clear instructions on water usage and conservation are important. This could include features like a water level indicator to prevent overfilling or a reminder to use filtered water if the machine is sensitive to hard water."
Sustainability: End-of-Life Management,"Designing for disassembly is crucial. The PDS should specify requirements for tool-less disassembly for key components or the use of standard fasteners.; Clear labeling of plastic components is essential. The PDS should mandate the use of standardized recycling codes (e.g., ISO 1043-1) on all plastic parts.; The take-back program is a significant undertaking. The PDS should outline the scope of this program (e.g., geographical coverage, cost to the consumer) and the criteria for participation.; Clear disposal instructions are necessary. This could include diagrams or links to online resources for recycling information specific to the product."
User Interface and Experience (UI/UX),"The 'intuitive and easy to navigate' requirement needs to be supported by specific design principles or user testing methodologies that will be employed to validate this.; A 'minimalist design aesthetic' is good, but the PDS should consider if this extends to the number of buttons, complexity of menus, and visual clutter on the display.; The 'small, integrated display or simple button interface' needs to be balanced with the functionality. For example, if multiple brewing options are offered, a simple button interface might become cumbersome.; The 'optional smart features' need to be clearly defined. What level of connectivity is envisioned (e.g., Wi-Fi, Bluetooth)? What are the core benefits of app connectivity beyond basic control?; Visual cues for status are important. The PDS should specify the types of cues (e.g., LED indicators, on-screen messages, audible alerts) and their meaning."
Durability and Reliability,"The target lifespan of 5-7 years is a good starting point. The PDS should also specify expected usage patterns (e.g., number of cups per day) to contextualize this lifespan.; Defining 'robust' components with specific stress tests or failure rate targets would be beneficial. For example, specifying the number of cycles for the pump or the temperature resistance of seals.; Rigorous testing is mentioned. The PDS should outline the types of testing (e.g., accelerated life testing, environmental testing, user testing) and the acceptance criteria.; A comprehensive warranty is a good indicator of confidence. The PDS should specify the duration and scope of the warranty."
Maintenance and Cleaning,"The PDS should specify which parts are intended to be dishwasher safe and the recommended cleaning cycles for those parts. For hand-washable parts, material compatibility with common cleaning agents should be considered.; Clear, step-by-step instructions are vital. This could involve incorporating visual aids or QR codes linking to video tutorials.; The automated cleaning cycle or prompt is a good user-centric feature. The PDS should define the triggers for these prompts (e.g., number of brews, time elapsed) and the duration/effectiveness of the automated cycle.; Minimizing complex internal components for cleaning is key. The PDS should consider modular design for easy access to internal parts that may require occasional cleaning or replacement."
Aesthetics and Form Factor,"While 'modern, sleek' is desirable, the PDS should consider defining specific design language or inspiration to ensure consistency and avoid subjective interpretations.; The range of color options should be justified. Prioritizing natural or muted tones aligns with sustainability, but the PDS could explore material finishes (e.g., matte, brushed) that enhance the aesthetic.; The 'relatively compact footprint' needs quantification. Specifying maximum dimensions (width, depth, height) would be more precise.; The 'tactile feel of materials' is important for premium products. The PDS could specify desired textures or finishes for key interaction points (e.g., buttons, handles)."
Safety Features,"Compliance with CE and UL certifications is a minimum requirement. The PDS should also consider other relevant regional safety standards.; Overheat protection and automatic shut-off are standard. The PDS could specify the temperature thresholds for overheat protection and the response mechanism (e.g., immediate shutdown, user notification).; Clear marking of hot surfaces is crucial. The PDS should define the type of marking (e.g., warning symbols, text labels) and their placement.; The water reservoir design should consider features like a secure lid, a stable base, and potentially a non-spill spout to prevent accidental spills during filling and operation."
Noise Level,"The target of 60-70 decibels is a good range, but it should be specified whether this is an average or peak noise level, and during which operational phase (e.g., grinding, brewing, steaming).; The PDS could explore specific noise reduction techniques, such as using quieter pumps, vibration dampening mounts, or acoustic insulation for the motor and pump housing.; Consider if different noise levels are acceptable for different functions (e.g., a slightly higher noise level during grinding might be acceptable if it's brief)."
Cost and Affordability,"Defining 'competitive within the premium segment' requires market research. The PDS should identify specific competitor products and their price points to establish a target retail price range.; The PDS should also consider the Bill of Materials (BOM) cost targets to ensure profitability at the desired retail price. This will involve trade-offs between material choices, component complexity, and manufacturing processes.; The 'total cost of ownership' is a key selling point for sustainable products. The PDS should quantify potential savings in energy and maintenance compared to less efficient machines.; Consider tiered pricing or feature sets if there's a desire to capture a slightly broader segment of the market."
Packaging,"Specifying the types of recyclable/compostable materials (e.g., recycled cardboard, mushroom packaging, cornstarch-based foam) would add clarity.; Minimizing packaging is good, but the PDS must ensure that the packaging provides adequate protection against damage during shipping and handling, which could lead to returns and waste.; Eco-friendly inks are important. The PDS should specify the type of inks (e.g., soy-based, vegetable-based) and any relevant certifications.; Clear instructions on recycling/composting are essential. This could include visual guides and information on local disposal facilities."
Ethical Sourcing and Manufacturing,"The PDS should outline specific criteria for ethical sourcing (e.g., certifications like Fair Trade, B Corp for suppliers) and manufacturing (e.g., ISO 14001 for environmental management, SA8000 for social accountability).; Transparency in the supply chain is crucial. The PDS could mandate the use of supply chain mapping tools or require suppliers to provide detailed origin information for key materials.; The carbon footprint mitigation strategy needs to be detailed. This could involve choosing local suppliers, optimizing logistics, or investing in carbon offsetting programs.; The PDS should consider the end-of-life of manufacturing waste and by-products, ensuring they are managed responsibly."
