Element,Critique
Core Functionality: Effective Particle and Debris Removal,"Define specific, quantifiable metrics for 'effective particle and debris removal' including filtration efficiency for fine particles (e.g., PM2.5). Target HEPA filtration (99.97% of particles down to 0.3 microns). Ensure performance is maintained over the product's expected lifetime. Design for easy separation of collected material for potential reuse or recycling."
Sustainability: Energy Efficiency,"Specify targets for motor efficiency (e.g., >90%), standby power consumption (<0.5W), and operational energy consumption (e.g., Energy Star rating). Detail mechanisms for achieving efficiency, such as optimized airflow design and intelligent power management. Consider energy consumed during manufacturing and transportation."
Sustainability: Material Selection and Circularity,"Mandate a minimum of 50% post-consumer recycled content for all plastic and metal components, with a target of 75% for structural parts. Prioritize mono-materials and easily separable material combinations. Avoid composite materials and glues. All plastic components must be clearly labeled with resin identification codes (e.g., PP, ABS) embossed in the mold. Minimize the number of *different* material types used. Focus on robust recyclability and design for disassembly. Biodegradable materials are to be used cautiously and only for specific, controlled applications (e.g., packaging)."
Sustainability: Durability and Longevity,"Specify quantifiable targets for product lifespan (e.g., 10 years of typical use or 2000 operational hours). Define rigorous testing protocols for structural integrity, motor durability (e.g., >5000 cycles), and wear-resistant components. Design for easy replacement of key wear parts (filters, brush rolls, batteries if applicable) and ensure availability of spare parts for at least 7 years. Consider modularity for future replacement of wear parts."
User Experience: Ease of Use and Ergonomics,"Ensure the product is lightweight (target <5kg) and ergonomically designed for comfortable handling. Simplify user-level maintenance tasks such as dustbin emptying and filter cleaning, ensuring they are easy, hygienic, and minimize dust re-emission. Design for intuitive control interfaces with minimal buttons. Ergonomics should also extend to ease of disassembly for repair."
User Experience: Noise Level,"Specify a maximum noise level of 70 dB(A) measured at 1 meter on a hard floor. Achieve this through optimized airflow, motor enclosure, and judicious use of lightweight, acoustically effective dampening materials. Avoid excessive material additions that compromise weight or recyclability."
Maintenance and Servicing,"Design for modularity and easy component replacement. Key components (motor, battery, electronics, brush head) should be accessible and replaceable with simple tools. Specify tool-less disassembly for user-level maintenance (e.g., filter changes). Provide clear, illustrated repair guides for common issues. Ensure spare parts are available for at least 7 years."
Filtration Performance,"Utilize HEPA filtration (99.97% of particles down to 0.3 microns). Specify filter materials that are recyclable or reusable where feasible. If disposable filters are used, they must be easily separable from their housings for recycling. Define filter lifespan and ease of replacement."
Dustbin/Bag Capacity and Management,"For bagless models, design for easy, hygienic emptying with minimal dust re-emission, using a sealed mechanism. Dustbins should be made from durable, easily cleanable, and recyclable plastic. If bags are used, they must be made from compostable or easily recyclable materials. Capacity should be sized for typical household use (e.g., 1.5-2L). Consider how collected material can be easily separated for its next life."
Safety Features,"Incorporate standard safety features like automatic overheat protection and secure electrical connections. Ensure electrical components and casings are fire retardant and non-toxic. Safety features must not impede disassembly for repair or recycling. If a battery is included, it must be easily removable and designed for safe handling and recycling."
Cost of Ownership,"Minimize ongoing costs by prioritizing energy efficiency, durability, and the use of affordable, recyclable materials. Ensure replacement parts (filters, brush rolls, batteries) are readily available and competitively priced. Clearly define the warranty period as part of the cost of ownership."
Aesthetics and Design Language,"Adopt a modern, clean, and minimalist design language using natural colors achieved through material choice and processing, not coatings that hinder recyclability. Materials should convey durability and quality. Avoid complex shapes that increase manufacturing difficulty or hinder disassembly and recycling."
End-of-Life Management and Disposal,"Design for disassembly using simple, standardized fasteners (e.g., Torx screws) and avoiding glues. All components must be clearly labeled with material type for recycling. Implement a product take-back program in partnership with recycling facilities to ensure responsible end-of-life management. Aim for maximum material recovery and recycling, with clear pathways for each component."
Packaging Sustainability,Specify a minimum of 80% post-consumer recycled content for all packaging materials. All packaging components must be recyclable or compostable. Design for 'right-sizing' to minimize void fill and transportation emissions. Avoid single-use plastics and styrofoam. Consider reusable packaging for spare parts and returned products.
Adaptability and Versatility,"Design attachments for durability, ease of cleaning, and recyclability. The attachment system should be robust, easy to use, and not add significant bulk or cost. Ensure attachments can be easily disassembled for repair or recycling. Prioritize a single, well-designed floor head with simple adjustments for versatility over multiple specialized heads."
