Conflict,Decision,Rationale
"Material & Design Expert prioritized avoiding glues for recyclability, while Production Engineer noted that glues might be unavoidable for certain seals and structural joints for durability.","Allow the use of glues only where absolutely necessary for structural integrity or sealing, provided they are low-VOC and demonstrably compatible with recycling processes or easily separable.","Engineering feasibility and product durability are paramount. While avoiding glues is ideal for recyclability, their complete elimination may compromise product performance and longevity. The focus will be on minimizing their use and selecting the most sustainable options when unavoidable."
"Material & Design Expert pushed for high PCR content (75% for structural parts) and Material types (mono-materials), while Production Engineer flagged challenges with sourcing consistent, high-quality PCR materials at scale and potential variability in part appearance and mechanical properties.","Target 50% PCR content for all plastic and metal components as a baseline, with a stretch goal of 75% for structural parts where feasible and validated for performance. Prioritize mono-materials and easily separable combinations, but allow for carefully selected, easily separable multi-material components if performance or durability necessitates it.","Sustainability is a key driver, but engineering feasibility and production reality must be addressed. The initial target of 75% PCR for structural parts may be too ambitious for mass production without compromising quality or significantly increasing costs. A phased approach with a strong baseline and clear research into higher PCR content for specific parts is more practical."
"Material & Design Expert emphasized avoiding composite materials and glues for recyclability, while Production Engineer pointed out that some composite materials might be necessary for high-performance components, and glues might be needed for seals.","Minimize the use of composite materials and glues. If a composite material or glue is deemed essential for critical performance or durability, a clear justification based on Life Cycle Assessment (LCA) must be provided, along with a plan for its disassembly and recycling/disposal.","While mono-materials and avoiding composites/glues are ideal for recyclability, engineering feasibility for high-performance applications may require them. The decision prioritizes sustainability by demanding rigorous justification and end-of-life planning for any exceptions."
"Material & Design Expert pushed for a 10-year lifespan and 2000 operational hours, while Production Engineer noted that achieving this might require higher-grade, more expensive components, potentially impacting cost.","Maintain the 10-year lifespan target, with a focus on rigorous accelerated life testing and defining acceptable performance degradation. The design team should explore cost-effective solutions for achieving this lifespan, prioritizing robust design and component selection over excessive over-engineering.","Product longevity is a cornerstone of sustainability. While cost is a factor, the long-term environmental benefit of a durable product outweighs the immediate cost savings of a less durable one. The focus will be on smart engineering to achieve durability within a reasonable cost framework."
"Material & Design Expert suggested tool-less maintenance for user-level tasks, while Production Engineer noted that tool-less mechanisms can be complex, prone to breakage, and costly.","Prioritize tool-less maintenance for user-replaceable components like filters and brush heads. For other user-accessible components, aim for disassembly with common household tools (e.g., Phillips head screwdriver). Complex tool-less mechanisms should only be used if they offer significant durability and user experience benefits that outweigh the production challenges.","User-centric sustainability means making maintenance easy. Tool-less for common tasks enhances user engagement and product lifespan. For less frequent repairs, common tools are a reasonable compromise to balance ease of use with manufacturing feasibility and durability."
"Material & Design Expert requested clear indicators for filter replacement, while Production Engineer questioned if this could add electronic complexity and cost, suggesting simpler mechanical indicators or usage guidelines.","Implement clear, simple, and cost-effective indicators for filter replacement. Prioritize mechanical indicators or clear usage guidelines over complex electronic solutions unless the latter can be demonstrated to significantly improve user compliance and reduce waste.","The goal is to ensure filters are replaced to maintain performance and prevent premature product failure, but without adding unnecessary cost or complexity that could hinder production or repairability."
"Material & Design Expert specified HEPA filtration, while Production Engineer noted it's a high-cost component and questioned the cost-effectiveness of achieving 99.97% efficiency at the target price point.","Maintain the HEPA filtration requirement, but require a thorough cost-benefit analysis of achieving the specified efficiency. Explore alternative filter materials or designs that can meet or closely approximate HEPA performance at a more competitive production cost, while still being recyclable or reusable.","Filtration performance is a core functionality that impacts user health and product effectiveness. While cost is a consideration, the sustainability aspect of effective filtration (preventing dust release) is also important. The team must find the most cost-effective way to meet the performance target."
"Material & Design Expert emphasized 'right-sizing' packaging to minimize void fill and transportation emissions, while Production Engineer stressed the need for adequate protection during transit to avoid damage and returns.","Achieve 'right-sizing' through optimized packaging design that balances minimal void space with robust protection for the product. This may involve using custom-molded inserts made from recycled materials where appropriate, and clearly defining acceptable transit stress levels for the packaging.","Both minimizing transport emissions and preventing product damage are critical for sustainability. The design must ensure the product reaches the consumer intact, but without excessive packaging material."
"Material & Design Expert advocated for a single, versatile floor head, while Production Engineer noted that this single head must be truly versatile and perform well across different floor types without overly complex mechanisms.","Design a single floor head that offers excellent performance across a range of common floor types (e.g., carpet, hard floors) through simple, intuitive adjustments. The complexity of these adjustments must be minimized to ensure manufacturability, durability, and ease of cleaning.",Reducing part count is a sustainability win. The challenge is to ensure this consolidated approach doesn't compromise performance. The design must balance versatility with simplicity and effectiveness.
"Material & Design Expert requested clear recyclability labeling (resin identification codes) and prioritization of mono-materials, while In-Service Expert noted potential challenges with complex internal wiring and electronic components.","Ensure clear recyclability labeling (resin identification codes) on all plastic components. Prioritize mono-materials and easily separable combinations. For internal wiring and electronic components, design for ease of separation and recovery of valuable materials, and clearly label these components where feasible.","While the casing is important, the recyclability of internal components also contributes to overall circularity. The team will focus on making these components as recoverable as possible."
"Material & Design Expert stated that safety features must not impede disassembly for repair or recycling, while Production Engineer noted that safety measures like potting or sealing can make disassembly difficult.","Integrate safety features in a manner that does not require destructive disassembly. Prioritize easily accessible electrical connections and components that can be safely disconnected and removed for repair or recycling. If potting or sealing is necessary for safety, ensure it is designed in a way that allows for eventual separation or recovery of materials.","Safety is non-negotiable. However, it should not be a barrier to repair or recycling. The design must find a balance between robust safety and end-of-life considerations."
"Material & Design Expert emphasized 'material separation' of collected debris for reuse/recycling, while Material & Design Expert and Circularity Expert noted that 'collected material' is mixed waste and impractical to reuse/recycle.","Reframe 'material separation' to focus on the easy separation of the *dustbin* from the vacuum body for recycling, and the hygienic, dust-free emptying of the dustbin for proper disposal of collected waste. The dustbin material itself must be easily cleanable and recyclable.",The initial interpretation of 'material separation' for collected debris was not feasible. The revised focus on the dustbin's recyclability and ease of emptying is a practical and achievable sustainability goal.
