PDS Element,Critique
Core Functionality: Effective Particle and Debris Removal,"The target suction power of 200 Air Watts (AW) is a good starting point, but it's crucial to specify the test conditions under which this is measured (e.g., specific hose/wand configuration, filter condition). Without this, it's difficult to benchmark effectively.; The airflow rate target of 35 L/s is reasonable, but again, test conditions are paramount for meaningful comparison. It would be beneficial to specify the pressure at which this airflow is measured.; While HEPA H13 is a strong standard, the PDS should consider specifying the efficiency at different particle sizes, especially those most relevant to allergens (e.g., <1 micron).; The dirt pickup performance targets (95% on hard floors, 90% on carpets) are good, but the PDS should define the specific test dust and methodologies used to achieve these figures. This ensures consistency and comparability.; The pet hair removal target of 90% is commendable. The PDS should detail the type of pet hair (e.g., short, long, coarse) and the specific surfaces (e.g., loop pile carpet, flat weave upholstery) used for testing.; The 'debris handling' point is somewhat vague. It would be more robust to define specific types and sizes of larger debris (e.g., oats, rice, small pebbles) and the expected pickup performance without clogging."
Sustainability: Energy Efficiency,"The target of under 30 kWh/year is a good aspirational goal, but the 'typical usage patterns' (1 hour/week) need to be clearly defined and justified. This calculation should be based on standardized testing protocols.; The operational power consumption targets (700W standard, 400W eco) are clear. However, it would be beneficial to specify the suction power achieved at these levels to ensure that energy efficiency doesn't significantly compromise performance.; The motor efficiency rating of 85% is excellent. The PDS should specify the load conditions under which this efficiency is achieved.; Aerodynamic optimization is a key aspect of efficiency. The PDS should mention specific design strategies or metrics that will be used to achieve this optimization (e.g., CFD analysis, internal ducting design)."
Sustainability: Material Selection and Circularity,"A minimum of 50% PCR plastic content is a strong target. The PDS should also consider specifying the types of plastics (e.g., PP, ABS) and their respective PCR content percentages, as some plastics are easier to source with high PCR content than others.; While clear recycling codes are essential, the PDS should also consider the ease of disassembly for sorting. Some snap-fit designs can be difficult to separate without tools, potentially hindering recycling.; The 'material sourcing' point is crucial but difficult to verify. The PDS should outline a process for supplier vetting and auditing to ensure transparency and ethical practices.; The exploration of bio-based or biodegradable plastics is positive. However, the PDS needs to address potential trade-offs in durability, UV resistance, and end-of-life processing for these materials. Biodegradable materials may not be suitable for all components if they require industrial composting facilities not widely available."
Sustainability: Durability and Longevity,"The 7-year lifespan target is ambitious and requires rigorous justification through accelerated testing. The PDS should detail the specific testing protocols and assumptions used to derive this figure.; The component durability ratings (brush roll motor 5,000 hours, main motor 3,500 hours) are good. It would be beneficial to specify the operating conditions under which these ratings are achieved (e.g., continuous operation, intermittent use).; The drop test from 1 meter is a good baseline. The PDS should specify the height of the drop and the type of surface (e.g., concrete, wood).; The cycle testing figures (brush roll 100,000, dustbin 20,000) are solid. The PDS should define what constitutes a 'cycle' for each component.; The 10-year spare parts availability is excellent for sustainability. The PDS should also consider the ease of access and affordability of these spare parts for the end-user."
User Experience: Ease of Use and Ergonomics,"The 3 kg weight limit for the main unit is a good target. However, the overall weight distribution and how it feels in hand during prolonged use are also critical and should be assessed through user testing.; The swivel steering radius of 180 degrees is standard. The PDS could benefit from specifying the turning circle on different floor types and the effort required to steer.; The 8-meter cord length is adequate for many homes, but it might be insufficient for larger spaces. Consider offering different cord length options or a cordless model.; The dustbin emptying target of under 10 seconds with minimal dust emission is excellent. The PDS should specify the method of dust emission measurement.; The 'three primary function buttons' is a good simplification. The PDS should indicate the placement and tactile feedback of these buttons.; The 10 cm clearance height is a common benchmark. The PDS could also consider the ability to lay the vacuum flat for cleaning under very low furniture.; User demographics and validation through user testing are crucial. The PDS should outline the specific user groups and testing methodologies to be employed."
User Experience: Noise Level,"The 70 dB(A) maximum noise level is a good target. It would be beneficial to specify the sound pressure level at different distances from the unit, as well as the sound power level.; Minimizing high-frequency, irritating tones is important. The PDS should consider specifying metrics for psychoacoustic comfort, not just overall dB(A) levels."
Maintenance and Servicing,"The tool-free access for filter and brush roll maintenance is excellent. The PDS should specify the expected frequency of these maintenance tasks based on usage.; The filter lifespan targets (HEPA 12 months, pre-motor 6 months) are reasonable. The PDS should also specify the conditions under which these lifespans are achieved (e.g., cleaning frequency, type of dirt).; The 'visually supported instructions' are key. The PDS should consider the use of augmented reality (AR) for maintenance guidance in the future."
Filtration Performance,"The HEPA H13 standard is well-defined. The PDS should also consider specifying the pressure drop across the filtration system at various airflow rates to ensure it doesn't significantly impact suction.; The PDS should address how the filtration system's performance will be maintained over its lifespan, especially as filters become loaded with dust."
Dustbin/Bag Capacity and Management,"The 1.5-liter capacity for bagless models is a good starting point. The PDS should consider the trade-off between capacity and the frequency of emptying, as larger capacity bins can sometimes be bulkier.; The dust re-emission target of < 5 mg/m³ during emptying is a strong metric. The PDS should detail the testing methodology for this.; If a bagged option is considered, the PDS should specify the filtration class of the bags themselves, in addition to the sealing mechanism."
Safety Features,Compliance with IEC 60335-1 and regional standards is mandatory. The PDS should list the specific regional standards that will be targeted.; The overheat protection temperature (105°C) and reset function are standard. The PDS could also consider specifying the duration of continuous operation before thermal cut-off is expected.
Cost of Ownership,"The target purchase price needs to be more specific. 'Mid-to-high range' is subjective. It would be better to provide a price bracket or a target MSRP.; The estimated annual operating cost of $25 USD is a good target. The PDS should clearly state the assumptions used in this calculation (electricity cost per kWh, usage hours, filter replacement frequency).; The affordability and availability of consumables are critical for long-term customer satisfaction and sustainability. The PDS should consider specifying the expected retail price range for replacement filters and brush rolls."
Aesthetics and Design Language,"The minimalist, modern aesthetic is a good direction. The PDS should consider developing a mood board or visual references to clearly communicate the desired look and feel.; The choice of matte finishes and muted earth tones aligns well with sustainability. The PDS should ensure that these finishes are durable and easy to clean.; The tactile feedback of controls is important for user experience. The PDS should define the desired 'feel' of buttons and switches (e.g., clicky, soft-touch)."
End-of-Life Management and Disposal,"The 15-minute disassembly time with common tools is a good target. The PDS should specify which common tools are assumed (e.g., Phillips head screwdriver).; The material labeling requirement is excellent. The PDS should also consider specifying the location and size of these labels for optimal visibility.; The feasibility of a take-back program needs thorough investigation. The PDS should outline the key considerations for such a program (logistics, cost, partnerships)."
Packaging Sustainability,"The 80% PCR content in cardboard and paper is a strong target. The PDS should consider specifying the source of this PCR content (e.g., post-consumer paper waste).; Eliminating single-use plastics is crucial. The PDS should detail the specific types of protective elements that will be used as alternatives (e.g., molded pulp, honeycomb cardboard).; The packaging volume and weight targets are good for minimizing material usage. The PDS should also consider the ease of opening and unpacking for the user.; ISTA-certified testing is a good assurance of transit protection. The PDS should specify the ISTA certification level required."
Adaptability and Versatility,"The inclusion of essential attachments is good. The PDS should also consider specialized attachments for specific needs, such as a pet grooming tool or a hard floor specific brush.; The motorized brush head is a key feature. The PDS should specify its performance characteristics (e.g., RPM, torque) for carpet cleaning and pet hair removal.; Onboard storage is convenient. The PDS should consider the ease of accessing and returning attachments to their storage locations.; The automatic adaptation of floor heads to different surfaces is a significant user experience improvement. The PDS should detail the mechanism for this adaptation and its reliability.; Variable suction power is essential. The PDS should specify the number of power levels and the increments between them."
