PDS Element,Justification
Core Functionality: Effective Particle and Debris Removal,"The primary function is to effectively remove particulate matter and debris from various surfaces. This must be quantifiable.; Minimum suction power: Target of at least 200 Air Watts (AW) on maximum setting for effective deep cleaning.; Airflow rate: Target of at least 35 Liters per second (L/s) to ensure efficient particle capture.; Filtration efficiency: Must achieve HEPA H13 standard, capturing 99.97% of particles down to 0.3 microns, ensuring expelled air is cleaner than ambient air.; Dirt pickup performance: Target of 95% pickup of fine dust on hard floors and 90% pickup of embedded dirt (e.g., sand) on low-pile carpets.; Pet hair removal: Specific performance target for removing pet hair from upholstery and carpets, aiming for at least 90% removal efficiency.; Debris handling: Ability to effectively pick up a range of debris sizes, from fine dust to larger particles (e.g., cereal) without clogging."
Sustainability: Energy Efficiency,"Minimize environmental impact through reduced energy consumption during operation.; Energy Star certification: Must meet or exceed current Energy Star requirements for vacuum cleaners.; Maximum annual energy consumption: Target of under 30 kWh/year based on typical usage patterns (e.g., 1 hour/week).; Operational power consumption: Standard mode not to exceed 700 Watts; Eco mode not to exceed 400 Watts.; Motor efficiency: Utilize a high-efficiency brushless DC motor with a minimum efficiency rating of 85% at optimal load.; Aerodynamic optimization: Design airflow paths to minimize turbulence and pressure loss, contributing to both suction power and energy efficiency.; Standby power: Maximum power consumption in standby mode not to exceed 0.5 Watts."
Sustainability: Material Selection and Circularity,"Prioritize materials with minimal environmental impact throughout their lifecycle, enabling a circular economy.; Recycled content: Minimum of 50% post-consumer recycled (PCR) plastic content in all major external plastic components (e.g., body, handle, dustbin).; Recyclability: All plastic components must be clearly marked with recycling codes (e.g., PP, ABS) and be readily recyclable through standard municipal recycling streams.; Hazardous substances: Strict adherence to RoHS and REACH regulations, avoiding heavy metals (lead, cadmium, mercury) and other restricted substances.; Design for disassembly: Components shall be joined using common fasteners (e.g., screws) or easily disengageable snap-fits. Avoid permanent adhesives where possible. Clear material labeling for ease of sorting.; Material sourcing: Prioritize suppliers with transparent and ethical supply chain practices, including verification of recycled material origins.; Bio-based materials: Explore the use of certified bio-based or biodegradable plastics for non-critical components where performance and durability are not compromised."
Sustainability: Durability and Longevity,"Extend product lifespan to reduce waste and the need for frequent replacements.; Expected product lifespan: Designed for a minimum of 7 years of typical household usage (equivalent to approximately 3,500 operational hours).; Component durability: Brush roll motor rated for a minimum of 5,000 operational hours; main motor rated for 3,500 operational hours.; Drop test: Withstand a drop from 1 meter onto a hard surface without loss of functionality or significant structural damage.; Cycle testing: Brush roll tested for a minimum of 100,000 cycles; dustbin emptying mechanism tested for 20,000 cycles.; Material quality: Use high-impact resistant plastics and wear-resistant components in high-stress areas.; Spare parts availability: Ensure critical spare parts (filters, brush rolls, seals) are available for a minimum of 10 years after product discontinuation."
User Experience: Ease of Use and Ergonomics,"Ensure the vacuum cleaner is comfortable, intuitive, and efficient to operate for a wide range of users.; Weight distribution: Balanced design with main unit weight (excluding hose/wand) not exceeding 3 kg for comfortable handling.; Handle design: Ergonomically shaped handle with non-slip grip, allowing for comfortable operation in various orientations.; Maneuverability: Swivel steering mechanism with a minimum turning radius of 180 degrees for easy navigation around obstacles. Wheels designed for smooth movement on various floor types.; Cord management: Minimum 8-meter cord length with a reliable, automatic retraction system.; Dustbin emptying: Single-hand operation for dustbin removal and emptying, completed in under 10 seconds with minimal dust emission (target < 5 mg/m³).; Control interface: Intuitive controls with a maximum of three primary function buttons (e.g., Power On/Off, Power Mode Select).; Clearance height: Designed to clean under furniture with a minimum clearance height of 10 cm.; User demographics: Design considerations for users with varying physical strengths and dexterity, validated through user testing."
User Experience: Noise Level,"Minimize operational noise to enhance user comfort and reduce disturbance.; Maximum noise level: Not to exceed 70 dB(A) on the standard power setting, measured at 1.5 meters from the unit.; Eco mode noise level: Not to exceed 65 dB(A) on the eco power setting.; Noise measurement conditions: Standard operating conditions on a hard floor surface.; Frequency spectrum: Minimize the presence of high-frequency, irritating tones through acoustic dampening and optimized airflow."
Maintenance and Servicing,"Simplify and expedite routine maintenance tasks to ensure optimal performance and longevity.; Filter maintenance: Tool-free access for filter cleaning and replacement. Target time for filter replacement: under 2 minutes.; Dustbin emptying: As per 'Ease of Use and Ergonomics' justification, designed for quick and hygienic emptying.; Brush roll cleaning: Tool-free access for clearing tangled hair and debris from the brush roll, or a self-cleaning brush roll mechanism.; Filter lifespan: HEPA filter rated for a minimum of 12 months of normal usage; pre-motor filters rated for 6 months.; Maintenance instructions: Clear, concise, and visually supported instructions provided in the user manual and accessible online."
Filtration Performance,"Ensure superior indoor air quality by effectively capturing fine particles and allergens.; HEPA standard: Minimum HEPA H13 filtration efficiency, capturing 99.97% of airborne particles down to 0.3 microns.; Filtration system lifespan: Designed to maintain performance for the specified filter lifespan (e.g., 12 months for HEPA) without significant degradation of suction power.; Ease of replacement: Filters must be easily accessible and replaceable by the user without tools.; Impact on airflow: Filtration system designed to minimize pressure drop, ensuring it does not unduly compromise core suction performance."
Dustbin/Bag Capacity and Management,"Provide adequate capacity for typical cleaning sessions and ensure hygienic, efficient emptying.; Minimum dustbin capacity: 1.5 liters for bagless models, allowing for multiple cleaning sessions before emptying.; Hygienic emptying: Design to minimize dust re-emission during emptying. Target < 5 mg/m³ of dust released.; Single-hand operation: Dustbin removal and reattachment should be achievable with a single hand.; Bagged option (if applicable): If a bagged model is considered, bags must be made of multi-layer, high-filtration material with a secure sealing mechanism for disposal."
Safety Features,"Guarantee user safety during operation and handling.; Safety certifications: Must comply with IEC 60335-1 and relevant regional safety standards (e.g., CE, UL, FCC).; Overheat protection: Automatic motor thermal cut-off at 105°C with a reset function after cooling.; Electrical safety: Insulation resistance > 20 MΩ; leakage current < 0.75 mA.; Cord safety: Durable cord material, strain relief at the connection points, and a securely fitted plug.; Stability: Design to prevent tipping during normal use and when the hose/wand is stored."
Cost of Ownership,"Ensure the total cost of owning and operating the vacuum cleaner is competitive and justifiable.; Target purchase price: Positioned within the mid-to-high range of the sustainable vacuum cleaner market, reflecting quality and features.; Estimated annual operating cost: Not to exceed $25 USD (based on average electricity rates and estimated usage, including energy and filter replacement).; Consumable cost: Replacement filters and brush rolls should be affordably priced and readily available."
Aesthetics and Design Language,"Create a visually appealing product that communicates its sustainable and high-quality attributes.; Design style: Minimalist, modern aesthetic with clean lines and a focus on functional form.; Material finish: Predominantly matte finishes for plastic components to reduce glare and enhance perceived quality. Accent elements may use brushed metal or wood-effect finishes.; Color palette: Primary colors will be muted earth tones (e.g., forest green, slate grey, sand beige). Accent colors will be subtle and natural (e.g., brushed aluminum, natural wood tones).; Tactile feedback: Controls and interaction points will have satisfying tactile feedback.; Integration: Aesthetic elements will not compromise functional performance or sustainability goals (e.g., avoiding chrome plating that is difficult to recycle)."
End-of-Life Management and Disposal,"Facilitate responsible disposal and maximize material recovery at the end of the product's life.; Disassembly time: Designed for disassembly for recycling purposes, achievable with common household tools (e.g., screwdriver) in under 15 minutes.; Material labeling: All plastic and metal components larger than 20 cm² must be clearly labeled with their material type using industry-standard symbols (e.g., ISO 11469).; Take-back program: Investigate feasibility of a manufacturer take-back program for responsible recycling.; Composite material reduction: Minimize the use of non-separable composite materials. Where unavoidable, ensure they are clearly identified for specialized recycling."
Packaging Sustainability,"Minimize the environmental footprint of product packaging.; Recycled content: Minimum 80% post-consumer recycled content in all cardboard and paper-based packaging.; Plastic reduction: Eliminate single-use plastics from primary packaging. Any necessary protective elements should be made from molded pulp or recycled cardboard.; FSC Certification: All paper and cardboard products used in packaging must be sourced from sustainably managed forests (FSC certified).; Packaging volume: Packaging volume shall not exceed 40% of the product's volume.; Packaging weight: Packaging weight shall not exceed 15% of the product's net weight.; Protective integrity: Packaging must provide adequate protection to prevent damage during transit, validated through ISTA-certified drop and vibration testing."
Adaptability and Versatility,"Provide a comprehensive cleaning solution for diverse household needs and surfaces.; Included attachments: Standard kit includes a crevice tool for tight spaces, an upholstery brush for fabrics, and a combination floor tool with adjustable settings for carpets and hard floors.; Motorized brush head: Include a powered brush head specifically designed for deep cleaning carpets and effectively removing pet hair.; Attachment storage: Onboard storage for crevice tool and upholstery brush. A separate wall-mountable storage solution for the main unit and other accessories should be offered.; Surface adaptation: Floor heads must be easily adjustable or automatically adapt to different floor types (e.g., carpet to hard floor transition).; Power adjustment: Variable suction power control allowing users to select optimal settings for different surfaces and cleaning tasks."
