Conflict,Decision,Rationale
Material & Design Expert's preference for bio-based plastics with clear biodegradability/compostability standards (EN 13432) versus Production Engineer's concern about the practicalities of industrial composting facilities and the target user's ability to compost them.,"Prioritize the use of bio-based plastics but mandate rigorous testing for UV resistance and durability to meet the 10-year lifespan, and specify that if EN 13432 certified materials are used, they must be clearly labeled for consumers regarding proper disposal, with an emphasis on industrial composting where accessible. If industrial composting is not feasible for the target user, explore alternative sustainable materials that offer comparable durability and recyclability.",The goal is to maximize sustainability while ensuring the material functions as intended and is actually manageable for the user or the waste stream. Direct composting by users can be unreliable. The durability requirement for a 10-year lifespan is paramount for sustainability through longevity. Focusing on industrial composting where possible and having clear disposal instructions is a more robust approach than relying on home composting for specialized materials.
"Production Engineer's concern that requiring 70% post-consumer recycled content for *all* metal components might limit supplier options, drive up costs, and impact lead times, versus Material & Design Expert and Circularity Expert's strong mandate for high recycled content across all metal components.","Maintain the 70% post-consumer recycled content target for all primary structural metal components (frame, fork, handlebars, seatpost). For secondary metal components (fasteners, small fittings), aim for the highest feasible percentage of recycled content, prioritizing availability and functional integrity. Implement a robust supplier qualification process to ensure consistent quality and supply.","The core structural elements have the most significant material impact. While a 70% target for all metal parts is ideal, it may be infeasible or prohibitively expensive for smaller, highly specialized components. Prioritizing the main frame and structural parts ensures the biggest sustainability win. For smaller parts, the focus shifts to availability, cost-effectiveness, and ensuring they still meet durability and recyclability requirements. This is a pragmatic approach to balance ambitious sustainability goals with production realities."
"Production Engineer's concern that requiring >50% renewable energy and >80% waste diversion from manufacturers adds significant verification burden and may limit the pool of potential manufacturing partners, versus Material & Design Expert and In-Service Expert's emphasis on these metrics for a sustainable manufacturing process.","Mandate >50% renewable energy usage and >80% waste diversion for the primary manufacturing facilities (frame production, assembly). For component suppliers, require them to provide data on their energy sources and waste management practices, with a preference for those meeting similar targets. Implement a tiered approach for supplier compliance, focusing on key suppliers first.","Achieving these targets for every single component supplier globally is extremely difficult and could severely limit options. Focusing on the core manufacturing stages of the bike (frame and final assembly) ensures the most significant impact. For other suppliers, requesting data and prioritizing those with better practices is a more manageable way to drive broader sustainability improvements across the supply chain without paralyzing production."
"Production Engineer's concern that V-brakes are cost-effective and easy to maintain, but mechanical disc brakes offer better performance, especially in wet conditions, versus In-Service Expert's emphasis on durability and ease of maintenance, and Material & Design Expert's focus on sustainable materials and minimal complexity.","Specify high-quality, durable mechanical disc brakes. Ensure they are specified with easily replaceable pads made from sustainable materials and that the braking system as a whole is designed for straightforward maintenance with standard tools.","While V-brakes are simpler, mechanical disc brakes offer significantly better performance, especially in varied urban conditions (wet, dirt), which directly contributes to user safety and confidence, thus promoting longer product use. The 'ease of maintenance' can be achieved with well-designed mechanical disc systems, and the sustainability benefit of better performance (preventing accidents, enabling use in more conditions) outweighs the slight increase in complexity or cost compared to V-brakes. Focus on pad material sustainability and ease of replacement."
"Material & Design Expert and Circularity Expert's strong preference for avoiding glues and composite materials for ease of disassembly and recyclability, versus Production Engineer's note that adhesives can offer unique benefits like sealing and vibration damping, and In-Service Expert's mention that some easily repairable mechanisms might use standard components that are already cost-effective.","Strictly prohibit the use of adhesives in any sub-assembly that is intended to be disassembled for repair or recycling. For components where adhesives might offer unique benefits (e.g., sealing on certain electronic housings if absolutely necessary), require that these components are designed as single, non-disassemblable units that are clearly labeled for specialized recycling, or that the adhesive itself is a 'debondable' type that allows for easier separation at end-of-life. Prioritize mechanical fastening and modular design for all repairable parts.","The prohibition of glues is a fundamental principle for disassembly and recycling. While adhesives have benefits, their use creates significant end-of-life challenges. If an adhesive is unavoidable for a specific, non-repairable component (like a sealed electronic module), it must be designed as a distinct unit for specialized recycling. For all parts intended for repair or general disassembly, mechanical fastening is the only acceptable method. This upholds the core sustainability principle of easy material separation."
