PDS Element,Justification
Target User Profile,"Define primary user personas with specific metrics: height range (155cm-190cm), weight capacity (up to 120kg), daily commute distance (5-15km), terrain (urban, paved, occasional light gravel).; Target lifespan: Minimum 10 years, with a minimum of 20,000 folding cycles and 50,000 km of riding.; Environmental consciousness: Users prioritize products with mandatory minimum 70% post-consumer recycled content for all major components (metal, plastic, rubber).; Key pain points addressed: Weight (<12kg target, balanced distribution), folding mechanism complexity (tool-free, few steps, robust), and ride comfort (optimized geometry, durable, separable contact points).; Commuting integration: Design includes secure mounting points for fenders and racks. Lighting is energy-efficient LED, rechargeable (user-replaceable batteries), and managed via a simple interface."
Core Functionality: Folding Mechanism,"Construct the folding mechanism using high-strength, durable, and recyclable aluminum alloys (minimum 70% post-consumer recycled content).; Prioritize robustness, security, and tool-free ease of use (few steps). Specify load cases (ISO 4210-2) and a fatigue life requirement of 20,000 folding cycles.; All joints utilize standard mechanical fasteners (screws, bolts) for accessibility, inspection, lubrication, and disassembly. Avoid glues and composite materials. Lubricants must be biodegradable and non-toxic.; Mechanism designed for disassembly into easily separable sub-assemblies using standard tools. Parts must be easily cleaned to prevent contamination of recycling streams.; Implement secure locking mechanisms proven against vibration and impact, preventing accidental unfolding. Testing protocols to verify robustness are required."
Core Functionality: Ride Performance,"Achieve ride performance comparable to a standard bicycle via optimized frame geometry, wheelbase, and steering, compensating for smaller wheel dynamics.; Omit advanced suspension systems. Focus on durable, puncture-resistant tires (minimum 30% recycled content) and ergonomic, separable contact points (saddle, grips) made from recyclable, compostable, or renewable materials.; Specify a gear range suitable for typical urban use cases (internal gear hub with 3-5 gears, ratio range 1.5-4.0), prioritizing models known for longevity and ease of servicing.; Components selected for longevity (e.g., tires: >5,000 km; chain/belt: >15,000 km) and minimal maintenance, with wear parts meeting standard sizes for easy replacement."
Sustainability: Material Selection,"Mandate minimum 70% post-consumer recycled content for all metal components (frame, fork, folding mechanism, rims).; For bio-based plastics (grips, pedals), mandate rigorous testing for UV resistance and durability (meeting 10-year lifespan). If EN 13432 certified, clearly label for proper disposal (prioritizing industrial composting where feasible).; Prohibit glues and minimize composite materials. Implement material passports or clear ISO 1043 labeling for all components to aid end-of-life processing and transparency.; Avoid materials that are difficult to recycle or separate (e.g., multi-layer composites)."
Sustainability: Manufacturing Processes,"Require primary manufacturing facilities (>50% renewable energy, >80% waste diversion) and component suppliers to provide data on energy sources and waste management.; Specify low-VOC or water-based powder coating for frames and components.; Mandate design for disassembly principles, focusing on mechanical fasteners and modular component design. Avoid adhesives or welding where disassembly is required.; Prioritize localized manufacturing where cost-effective and sustainable, provided ethical labor practices (SA8000 certification) are met."
Sustainability: Durability and Longevity,"Specify performance standards: wear resistance, fatigue life (20,000 folding cycles), and corrosion resistance (500-hour salt spray test).; Define 'critical wear parts' (e.g., brake pads, chains, tires) as easily replaceable modules with standard sizes, made from sustainable materials.; Design for easy access and replacement of wear parts without extensive disassembly. Target MTBF >5,000 hours for key components.; Offer a 5-year warranty on frame/mechanism, 2-year on others, clearly defining 'normal use' and expected lifespan."
Weight,"Target overall weight of 10-15 kg, achieved through optimized structural design of recycled aluminum and durable, standard components.; Ensure balanced weight distribution when folded for carrying, with the center of gravity located centrally.; Weight reduction strategies must not compromise ease of disassembly or recyclability (e.g., avoid thin-walled structures difficult to separate)."
Dimensions (Unfolded and Folded),"Wheel size: 20-inch diameter, balanced for folded size, ride stability, and availability of standard, recyclable tires.; Folded dimensions: Compact envelope suitable for common storage locations, ensuring components are protected by the folded form.; Folded bike will be self-supporting and stable, with integrated features for easy handling and storage. Folding mechanism must not compromise component protection."
Ergonomics and Comfort,"Seat height and handlebar adjustability via durable, easily repairable mechanisms.; Contact point materials (saddle, grips) made from recyclable, compostable, or renewable materials, easily separable without adhesives, and UV-resistant.; Folding mechanism designed to eliminate pinch points and ensure comfortable rider interaction, with easily accessible adjustment points."
Aesthetics and Styling,"Utilize 'natural tones' and 'muted colors' with durable, low-VOC powder coating finishes.; Prioritize functional aesthetics that signal repairability (e.g., visible mechanical fasteners).; Avoid design choices necessitating difficult-to-recycle materials or complex integrated structures hindering disassembly.; Finishes must resist chipping and fading to promote longevity and maintain appearance."
Safety Features,"Brakes: High-quality, durable mechanical disc brakes with easily replaceable pads made from sustainable materials.; Lighting: Energy-efficient LEDs with user-replaceable batteries (e.g., AA/AAA NiMH) and a clear end-of-life management plan for the battery housing and light unit.; Reflectivity: Integrated reflective elements on wheels and frame.; Folding mechanism: Reliable mechanical safety locks proven against accidental release."
Durability and Robustness,"Frame and critical components designed to withstand regular use, vibration, and impact, meeting specified fatigue and corrosion resistance standards.; Material strength requirements defined for key structural elements and folding joints.; Components selected for resistance to corrosion and weather elements, with environmentally friendly surface treatments that do not impede material recovery."
Maintenance and Repair,"Mandate use of standard, widely available bicycle components for all parts except the core folding mechanism.; Design folding mechanism and wear parts for modularity and easy replacement using standard tools. Specify expected maintenance frequencies.; Provide clear, visual, and digitally accessible maintenance and repair instructions.; Specify easily separable fasteners and prohibit adhesives in all repairable sub-assemblies."
Cost Target,"Achieve target cost by optimizing use of recycled materials, efficient manufacturing, and standard components.; Prioritize total cost of ownership (longevity, repairability) over lowest initial purchase price. Cost-cutting measures compromising durability, repairability, or sustainability are unacceptable.; Clearly articulate the value proposition of a sustainable, long-lasting, and repairable product to justify price."
Environmental Certifications and Standards,"Prioritize product-specific certifications: SCS Recycled Content (metals), EN 13432 (compostable plastics), ISO 1043 material labeling.; Include 'design for disassembly' certifications or assessments.; Align with durability testing standards (EN standards for bicycles). Ensure compliance with chemical safety regulations (REACH, RoHS).; Focus on product-level verification."
Portability and Storage Solutions,Design integrated carrying handles and kickstands for durability and easy separation for recycling.; Optional carrying bags (if offered) must be made from demonstrably recycled/recyclable materials and be repairable.; Ensure the folded bike is stable and protects critical components during storage and transport.
Noise Reduction,"Specify acceptable noise levels: Max 60 dB during riding (15 km/h), Max 50 dB during folding/unfolding.; Incorporate noise reduction via well-machined components and appropriate materials (high-density polymers) for contact points.; Ensure noise-reduction measures do not involve permanent bonding or composite materials hindering recyclability.; Specify biodegradable or low-impact lubricants."
User Interface and Controls,"Use standard, durable bicycle controls (shifters, brake levers) with ergonomic design.; Integrated electronics (lights) must have user-replaceable batteries and easily separable components for repair/recycling.; Controls must be robust, weather-resistant, not interfere with folding, and provide clear tactile feedback."
Packaging,"Mandate minimal packaging from high-percentage post-consumer recycled content (cardboard, paper), easily recyclable.; Avoid mixed materials, glues, and plastics hindering recyclability.; Explore reusable packaging solutions where feasible.; Ensure packaging adequately protects the bike during transit, considering environmental impact of production."
End-of-Life Management,"Detailed design for disassembly plan: standard fasteners, modular components, clear ISO 1043 material labeling.; Strategy for product return and processing, incentivized through take-back programs or recycling credits.; Minimize hazardous materials; clearly document location and safe management.; Strictly prohibit glues and composite materials that impede disassembly and recycling."
