PDS Element,Critique
Core Functionality: Blending,"The PDS correctly identifies the primary purpose but lacks specific quantitative targets for motor power (e.g., wattage or RPM). This makes it difficult to objectively assess if the motor will be 'powerful enough' for various ingredients, especially ice.; While 'efficient' blending is mentioned, it's subjective. Quantifiable metrics like particle size distribution after a set blending time for specific ingredients (e.g., frozen berries, leafy greens) would be beneficial.; The requirement for 'variable speed settings or pulse functionality' is good, but specific ranges or levels for variable speed, or duration for pulse, are not defined.; The PDS states the jar should 'optimize ingredient flow', which is a design goal. It would be more precise to specify the desired outcome, such as 'minimize ingredient adherence to jar walls' or 'ensure all ingredients reach the blade vortex'."
Portability and Compactness,"The weight target of 'under 1.5 kg' is reasonable but could be further refined by setting a more ambitious target (e.g., under 1 kg) if feasible, given the 'portable' nature.; The mention of 'stable base' is important, but specific requirements for stability (e.g., resistance to tipping under a certain angle or force) are missing.; While fitting into backpacks and gym bags is a good qualitative goal, defining maximum dimensions (e.g., height, diameter) would provide a more concrete design constraint."
Power Source: Rechargeable Battery,"The 'minimum of 10-15 blending cycles' is a good start, but it's crucial to define what constitutes a 'blending cycle' (e.g., duration, ingredient type, speed setting). This significantly impacts the perceived battery life.; While USB-C is preferred, specifying the charging standard (e.g., USB PD, Quick Charge) could inform the design for faster charging.; The PDS mentions 'charging indicator' but doesn't specify the granularity (e.g., 3-LED system, percentage display) or the visual cues for 'low battery'."
Durability and Material Selection,"While specific materials like Tritan and ABS are suggested, the PDS could benefit from specifying performance standards for these materials (e.g., drop test resistance for the jar, scratch resistance for the housing).; The PDS states blades should be 'food-grade stainless steel for longevity and effective cutting'. Defining a minimum hardness or wear resistance for the blades would add a quantifiable aspect to 'longevity'.; Resistance to staining and odor absorption is a good qualitative goal. Quantifying this through standardized testing (e.g., exposure to common staining agents like turmeric or coffee for a set duration) would be more robust."
Ease of Cleaning,"Stating that components should be 'dishwasher-safe' is a good starting point. However, specifying the expected outcome after multiple dishwasher cycles (e.g., no degradation of material, no loss of clarity for the jar) would be more comprehensive.; The 'motor base should be wipeable and resistant to liquid ingress' is crucial. Defining a specific IP rating (e.g., IPX4 for splash resistance) would provide a clear, testable benchmark.; The 'blade assembly should be designed for safe and easy detachment' is a good functional requirement. Specifying a maximum detachment/attachment time or requiring tool-less removal would add detail."
User Safety,"The 'safety interlock mechanism' is essential. Specifying the required force or mechanism to disengage the interlock would be beneficial for design and testing.; The PDS mentions 'blades should be protected when the lid is on and the unit is not in operation'. This is a critical safety feature and could be further elaborated by specifying the degree of protection (e.g., requiring a tool to access blades, or ensuring blades are fully enclosed within the jar when not blending).; Overheating protection is mentioned. Defining the temperature threshold or the mechanism (e.g., auto shut-off after X minutes of continuous use) would be more precise."
Sustainability and Environmental Impact,"The preference for 'recycled or recyclable content' is good. Specifying target percentages for recycled content in specific components (e.g., 30% recycled ABS for housing) would make this requirement more actionable.; The 'battery should be designed for longevity and be easily replaceable'. This is a strong sustainability goal. Defining a target lifespan (e.g., minimum number of charge cycles before significant capacity degradation) and specifying the ease of replacement (e.g., tool-less access) would be valuable.; While 'energy efficiency' is mentioned, providing target metrics for standby power consumption or energy consumed per blending cycle would be more concrete.; The PDS states 'product should be designed for disassembly'. Specifying the number of unique fasteners or the average time to disassemble for recycling would provide a measurable goal."
Aesthetics and Ergonomics,"The PDS mentions 'appealing and modern design' and 'attractive color options' which are subjective. While difficult to quantify, referencing successful competitor designs or creating mood boards could help define the aesthetic direction.; For ergonomics, specifying target grip diameters for the jar and lid, or requiring a non-slip texture, would be more concrete than just 'secure and comfortable'.; The 'intuitive and easy to use' control interface is a goal. Defining the maximum number of buttons, or specifying a single-button operation with different press durations for functions, would provide more specific design constraints."
Capacity and Volume,"The specified range of 350ml to 500ml is appropriate. However, it would be beneficial to specify the 'usable' capacity versus the 'total' capacity of the jar, especially considering headspace needed for blending.; The requirement for 'clearly marked volume markings' is good. Specifying the interval between markings (e.g., every 50ml) and the accuracy of these markings would enhance this requirement."
Noise Level,"The target of 'below 80 dB' is a good quantitative metric. It would be beneficial to specify the conditions under which this measurement is taken (e.g., at a specific distance from the unit, with specific ingredients).; The mention of 'sound dampening materials' is a design suggestion. The PDS could be strengthened by setting a performance goal related to vibration reduction as well."
Performance Metrics,"The 'blending time' of 30-60 seconds is a good target. It's crucial to define the 'standard ingredients' used for this test (e.g., a specific ratio of frozen fruit, liquid, and ice).; The 'ice crushing capability' test needs more definition. Specifying the type of ice (cubed, crushed), the quantity, and the desired end state (e.g., uniformly crushed ice, not slush) would be more precise.; The PDS states 'charging time: Time required to fully charge the battery (e.g., 2-3 hours)'. This is a good quantitative target. It would be beneficial to also specify the charging method (e.g., using a standard 5V/2A USB adapter) for consistency."
Cost Target,"The price range of $50-$100 USD is a reasonable target. However, it's essential to link this target back to specific material and manufacturing choices. For example, achieving the lower end of the range might necessitate compromises on certain premium sustainable materials or features.; It would be beneficial to break down the cost target into key component cost targets (e.g., motor, battery, housing, electronics) to guide the design and sourcing process."
Maintenance and Repairability,"The PDS states the 'battery should be designed for easy replacement'. Defining what 'easy' means (e.g., user-replaceable with a specific tool, or requiring minimal disassembly) would be more concrete.; The availability of 'commonly wearing parts' is good. Specifying which parts are considered 'commonly wearing' and their target lifespan (e.g., blade assembly rated for 500 cycles) would be valuable.; Providing 'clear instructions for basic maintenance and troubleshooting' is a good requirement. This could be further enhanced by specifying the format (e.g., user manual, online video tutorials) and the level of detail required."
